,author_id,gender,hometown,book_title,book_isbn,book_isbn13,book_average_rating,book_publisher
0,14980615,female,"Albuquerque, New Mexico",The Magnolia Story,{'@nil': 'true'},{'@nil': 'true'},4.18,
1,14980615,female,"Albuquerque, New Mexico",Capital Gaines: Smart Things I Learned Doing Stupid Stuff,0785216308,9780785216308,4.01,Thomas Nelson
2,14980615,female,"Albuquerque, New Mexico",Building a Network: The Power of Relationships in Work and in Life,1713529122,9781713529125,3.00,Thomas Nelson on Brilliance Audio
3,14980615,female,"Albuquerque, New Mexico",Homebody / Magnolia Table,8925599376,9788925599373,4.33,
4,14980615,female,"Albuquerque, New Mexico",What Makes a Marriage Last: 40 Celebrated Couples Share with Us the Secrets to a Happy Life,{'@nil': 'true'},{'@nil': 'true'},4.08,HarperAudio
5,14980615,female,"Albuquerque, New Mexico",I Choose Peace: Raw Stories of Real People Finding Contentment and Happiness,{'@nil': 'true'},{'@nil': 'true'},4.30,Thomas Nelson
6,33280,,"Cleveland, OH","Captain Underpants and the Attack of the Talking Toilets (Captain Underpants, #2)",0439995442,9780439995443,4.06,Scholastic
7,33280,,"Cleveland, OH","The Adventures of Captain Underpants (Captain Underpants, #1)",0439014573,9780439014571,3.96,Scholastic Children's Books
8,33280,,"Cleveland, OH","Dog Man (Dog Man, #1)",0545581605,9780545581608,4.16,Graphix
9,33280,,"Cleveland, OH",The Adventures of Ook and Gluk: Kung Fu Cavemen from the Future,0545175305,9780545175302,4.21,The Blue Sky Press
10,33280,,"Cleveland, OH","Captain Underpants and the Perilous Plot of Professor Poopypants (Captain Underpants, #4)",0439998190,9780439998192,4.21,Scholastic
11,33280,,"Cleveland, OH","Captain Underpants and the Invasion of the Incredibly Naughty Cafeteria Ladies from Outer Space and the Subsequent Assault of the Equally Evil Lunchroom Zombie Nerds (Captain Underpants, #3)",0439997100,9780439997102,4.19,
12,33280,,"Cleveland, OH","Captain Underpants and the Big, Bad Battle of the Bionic Booger Boy, Part 1: The Night of the Nasty Nostril Nuggets (Captain Underpants, #6)",0439376106,9780439376105,4.18,Scholastic Paperbacks
13,33280,,"Cleveland, OH","Captain Underpants and the Big Bad Battle of the Bionic Booger Boy, Part 2: Revenge of the Ridiculous Robo-Boogers (Captain Underpants, #7)",043997772X,9780439977722,4.20,"Scholastic, Inc."
14,33280,,"Cleveland, OH","Captain Underpants and the Wrath of the Wicked Wedgie Woman (Captain Underpants, #5)",0439994802,9780439994804,4.18,Scholastic
15,33280,,"Cleveland, OH","The Adventures of Super Diaper Baby (Super Diaper Baby, #1)",0439376068,9780439376068,4.24,Blue Sky Press
16,61105,male,"Springfield, MA",Green Eggs and Ham,0394800168,9780394800165,4.30,Random House Books for Young Readers
17,61105,male,"Springfield, MA","The Cat in the Hat (The Cat in the Hat, #1)",039480001X,9780394800011,4.17,Random House Books for Young Readers
18,61105,male,"Springfield, MA","Oh, the Places You'll Go!",0679805273,9780679805274,4.35,Random House Books for Young Readers
19,61105,male,"Springfield, MA",How the Grinch Stole Christmas!,0007173040,9780007173044,4.36,Harper Collins Children's Books
20,61105,male,"Springfield, MA",The Lorax,0679889108,9780679889106,4.34,Random House Books for Young Readers
21,61105,male,"Springfield, MA","One Fish, Two Fish, Red Fish, Blue Fish",0007173687,9780007173686,4.13,Harper Collins Children's Books
22,61105,male,"Springfield, MA",Horton Hears a Who!,0679800034,9780679800033,4.18,Random House Books for Young Readers
23,61105,male,"Springfield, MA",The Sneetches and Other Stories,0007158505,9780007158508,4.30,HarperCollins Publishers
24,61105,male,"Springfield, MA",The Cat in the Hat and Other Dr. Seuss Favorites,0807218731,9780807218730,4.41,Listening Library (Audio)
25,61105,male,"Springfield, MA",Fox in Socks,0007158475,9780007158478,4.07,Green Back Books / HarperCollins Children's Books
26,3362,male,"Syracuse, New York",The Very Hungry Caterpillar,0241003008,9780241003008,4.30,Puffin Books
27,3362,male,"Syracuse, New York",The Very Busy Spider,0399229191,9780399229190,4.19,Philomel Books
28,3362,male,"Syracuse, New York",The Grouchy Ladybug,0064434508,9780064434508,4.10,HarperCollins
29,3362,male,"Syracuse, New York",The Very Quiet Cricket,0399218858,9780399218859,4.04,Philomel Books
30,3362,male,"Syracuse, New York",From Head to Toe,0061119725,9780061119729,4.20,HarperFestival
31,3362,male,"Syracuse, New York",The Mixed-Up Chameleon,0694011479,9780694011476,4.23,HarperFestival
32,3362,male,"Syracuse, New York",A House for Hermit Crab,1416903097,9781416903093,4.15,Aladdin
33,3362,male,"Syracuse, New York",The Tiny Seed,0689842449,9780689842443,4.14,Aladdin
34,3362,male,"Syracuse, New York",The Very Lonely Firefly,0399227741,9780399227745,4.16,Philomel Books
35,3362,male,"Syracuse, New York","Papa, Please Get the Moon for Me",0887081770,9780887081774,4.16,Simon  Schuster Books for Young Readers
36,4880403,female,,The Wonderful Things You Will Be,0385376715,9780385376716,4.40,Random House Books for Young Readers
37,4880403,female,,Snow & Rose,{'@nil': 'true'},{'@nil': 'true'},3.98,
38,4880403,female,,Dream Animals: A Bedtime Journey,0449810801,9780449810804,4.34,Random House Books for Young Readers
39,4880403,female,,Day Dreamers: A Journey of Imagination,0375973265,9780375973260,4.09,Random House Books for Young Readers
40,4880403,female,,Oddfellow's Orphanage,0375869956,9780375869952,3.74,Random House Books for Young Readers
41,4880403,female,,The Littlest Family's Big Day,0553511025,9780553511024,3.84,Random House Books for Young Readers
42,4880403,female,,The Imaginaries: Little Scraps of Larger Stories,0375974326,9780375974328,4.39,Random House Books for Young Readers
43,4880403,female,,The Black Apple's Paper Doll Primer: Activities and Amusements for the Curious Paper Artist,0307586561,9780307586568,4.43,Potter Craft
44,4880403,female,,Emily Winfield Martin's Dreamers Board Boxed Set,1524714437,9781524714437,4.70,Random House Books for Young Readers
45,4880403,female,,The Wonderful Baby You Are: A Record of Baby's First Year: Baby Memory Book with Milestone Stickers and Pockets,0525574581,9780525574583,4.50,Clarkson Potter Publishers
46,217195,female,,Jesus Calling: Enjoying Peace in His Presence,1591451884,9781591451884,4.49,Thomas Nelson
47,217195,female,,Jesus Calling: 365 Devotions For Kids,1400316340,9781400316342,4.66,Thomas Nelson
48,217195,female,,Jesus Today: Experience Hope Through His Presence,1400320097,9781400320097,4.62,Thomas Nelson
49,217195,female,,Jesus Always: Embracing Joy in His Presence,0718039505,9780718039509,4.67,Thomas Nelson
50,217195,female,,Jesus Calling Morning and Evening Devotional,{'@nil': 'true'},{'@nil': 'true'},4.66,
51,217195,female,,Jesus Calling: A 365-Day Journaling Devotional,1404187855,9781404187856,4.53,Thomas Nelson Publishers
52,217195,female,,Jesus Calling Bible Storybook,140032033X,9781400320332,4.56,Thomas Nelson
53,217195,female,,Dear Jesus: Seeking His Life in Your Life,{'@nil': 'true'},{'@nil': 'true'},4.57,
54,217195,female,,Jesus Lives Devotional: Seeing His Love in Your Life,1404189661,9781404189669,4.64,Thomas Nelson
55,217195,female,,40 Days With Jesus: Celebrating His Presence,{'@nil': 'true'},{'@nil': 'true'},4.58,
56,5086768,male,,"Brown Bear, Brown Bear, What Do You See?",0805047905,9780805047905,4.21,Henry Holt and Co.
57,5086768,male,,Chicka Chicka Boom Boom,068983568X,9780689835681,4.23,Beach Lane Books
58,5086768,male,,"Polar Bear, Polar Bear, What Do You Hear?",0805053883,9780805053883,4.17,Henry Holt and Co. (BYR)
59,5086768,male,,"Panda Bear, Panda Bear, What Do You See?",0805017585,9780805017588,4.23,Henry Holt and Co. (BYR)
60,5086768,male,,"Chicka Chicka 1, 2, 3",0689858817,9780689858819,4.15,Simon  Schuster Books for Young Readers
61,5086768,male,,"Baby Bear, Baby Bear, What Do You See?",0805083367,9780805083361,4.24,Henry Holt & Company
62,5086768,male,,Ten Little Caterpillars,144243385X,9781442433854,4.00,Beach Lane Books
63,5086768,male,,Knots on a Counting Rope,0805054790,9780805054798,4.00,Square Fish
64,5086768,male,,Spunky Little Monkey,0545776430,9780545776431,3.77,Scholastic Press
65,5086768,male,,Here Are My Hands,0805011684,9780805011685,3.88,Square Fish
66,59483,,Kyoto,The Legend of Zelda: Hyrule Historia,1616550414,9781616550417,4.56,Dark Horse Books
67,59483,,Kyoto,The Legend of Zelda: Art & Artifacts,1506703356,9781506703350,4.51,Dark Horse Books
68,59483,,Kyoto,The Legend of Zelda: Encyclopedia,150670638X,9781506706382,4.58,Dark Horse Books
69,59483,,Kyoto,The Legend of Zelda: Breath of the Wild — Creating a Champion,1506710107,9781506710105,4.72,Dark Horse Books
70,59483,,Kyoto,Super Mario Bros. Encyclopedia,1506702996,9781506702995,4.25,
71,59483,,Kyoto,The Art of Splatoon,150670400X,9781506704005,4.61,Dark Horse Books
72,59483,,Kyoto,Super Mario Maker,{'@nil': 'true'},{'@nil': 'true'},4.00,
73,59483,,Kyoto,The Art of Super Mario Odyssey,1506713750,9781506713755,4.37,Dark Horse Books
74,59483,,Kyoto,The Art of Splatoon 2,1506713742,9781506713748,4.58,Dark Horse Books
75,59483,,Kyoto,Pokemon Crystal Version: The Official Nintendo Player's Guide,{'@nil': 'true'},9781930206120,4.76,
76,6906496,,,Humans of New York: Stories,1250058902,9781250058904,4.54,St. Martin's Press
77,6906496,,,Humans of New York,1250038820,9781250038821,4.48,St. Martin's Press
78,6906496,,,Little Humans,0374374562,9780374374563,4.11,Macmillan Australia
79,6906496,,,Humans,{'@nil': 'true'},{'@nil': 'true'},4.55,
80,6906496,,,Tribe of Mentors: Short Life Advice from the Best in the World,{'@nil': 'true'},{'@nil': 'true'},4.15,Audible Studios
81,7064519,,,Strange Planet,0062970704,9780062970701,4.33,Morrow Gift
82,7064519,,,Stranger Planet,0063022605,9780063022607,4.60,Morrow Gift
83,7064519,,,NYC Basic Tips and Etiquette,0062303112,9780062303110,4.23,William Morrow Paperbacks
84,7064519,,,99 Stories I Could Tell: A Doodlebook To Help You Create,0062748351,9780062748355,3.97,Morrow Gift
85,7064519,,,Planeta Estranho: Os seres mais queridos do Instagram vão pousar no Brasil!,{'@nil': 'true'},{'@nil': 'true'},5.00,
86,7064519,,,"Strange Planet: The Sneaking, Hiding, Vibrating Creature",0063049740,9780063049741,0.0,HarperCollins
87,1077326,female,"Yate, South Gloucestershire, England","Harry Potter and the Sorcerer's Stone (Harry Potter, #1)",{'@nil': 'true'},{'@nil': 'true'},4.47,Scholastic Inc
88,1077326,female,"Yate, South Gloucestershire, England","Harry Potter and the Prisoner of Azkaban (Harry Potter, #3)",043965548X,9780439655484,4.57,Scholastic Inc.
89,1077326,female,"Yate, South Gloucestershire, England","Harry Potter and the Chamber of Secrets (Harry Potter, #2)",0439064864,9780439064866,4.43,Arthur A. Levine Books / Scholastic Inc.
90,1077326,female,"Yate, South Gloucestershire, England","Harry Potter and the Goblet of Fire (Harry Potter, #4)",{'@nil': 'true'},{'@nil': 'true'},4.56,Scholastic
91,1077326,female,"Yate, South Gloucestershire, England","Harry Potter and the Order of the Phoenix (Harry Potter, #5)",0439358078,9780439358071,4.50,Scholastic Inc.
92,1077326,female,"Yate, South Gloucestershire, England","Harry Potter and the Half-Blood Prince (Harry Potter, #6)",{'@nil': 'true'},{'@nil': 'true'},4.57,Scholastic Inc.
93,1077326,female,"Yate, South Gloucestershire, England",The Tales of Beedle the Bard,0747599874,9780747599876,4.06,Bloomsbury
94,1077326,female,"Yate, South Gloucestershire, England","Harry Potter Series Box Set (Harry Potter, #1-7)",0545044251,9780545044257,4.73,Arthur A. Levine Books
95,1077326,female,"Yate, South Gloucestershire, England",The Casual Vacancy,0316228532,9780316228534,3.30,"Little, Brown and Company"
96,1077326,female,"Yate, South Gloucestershire, England","Harry Potter and the Order of the Phoenix (Harry Potter, #5, Part 1)",185549664X,9781855496644,4.62,BBC Audiobooks
97,1077326,female,"Yate, South Gloucestershire, England","Harry Potter and the Sorcerer's Stone (Harry Potter, #1)",{'@nil': 'true'},{'@nil': 'true'},4.47,Scholastic Inc
98,1077326,female,"Yate, South Gloucestershire, England","Harry Potter and the Prisoner of Azkaban (Harry Potter, #3)",043965548X,9780439655484,4.57,Scholastic Inc.
99,1077326,female,"Yate, South Gloucestershire, England","Harry Potter and the Chamber of Secrets (Harry Potter, #2)",0439064864,9780439064866,4.43,Arthur A. Levine Books / Scholastic Inc.
100,1077326,female,"Yate, South Gloucestershire, England","Harry Potter and the Goblet of Fire (Harry Potter, #4)",{'@nil': 'true'},{'@nil': 'true'},4.56,Scholastic
101,1077326,female,"Yate, South Gloucestershire, England","Harry Potter and the Order of the Phoenix (Harry Potter, #5)",0439358078,9780439358071,4.50,Scholastic Inc.
102,1077326,female,"Yate, South Gloucestershire, England","Harry Potter and the Half-Blood Prince (Harry Potter, #6)",{'@nil': 'true'},{'@nil': 'true'},4.57,Scholastic Inc.
103,1077326,female,"Yate, South Gloucestershire, England",The Tales of Beedle the Bard,0747599874,9780747599876,4.06,Bloomsbury
104,1077326,female,"Yate, South Gloucestershire, England","Harry Potter Series Box Set (Harry Potter, #1-7)",0545044251,9780545044257,4.73,Arthur A. Levine Books
105,1077326,female,"Yate, South Gloucestershire, England",The Casual Vacancy,0316228532,9780316228534,3.30,"Little, Brown and Company"
106,1077326,female,"Yate, South Gloucestershire, England","Harry Potter and the Order of the Phoenix (Harry Potter, #5, Part 1)",185549664X,9781855496644,4.62,BBC Audiobooks
107,1077326,female,"Yate, South Gloucestershire, England","Harry Potter and the Sorcerer's Stone (Harry Potter, #1)",{'@nil': 'true'},{'@nil': 'true'},4.47,Scholastic Inc
108,1077326,female,"Yate, South Gloucestershire, England","Harry Potter and the Prisoner of Azkaban (Harry Potter, #3)",043965548X,9780439655484,4.57,Scholastic Inc.
109,1077326,female,"Yate, South Gloucestershire, England","Harry Potter and the Chamber of Secrets (Harry Potter, #2)",0439064864,9780439064866,4.43,Arthur A. Levine Books / Scholastic Inc.
110,1077326,female,"Yate, South Gloucestershire, England","Harry Potter and the Goblet of Fire (Harry Potter, #4)",{'@nil': 'true'},{'@nil': 'true'},4.56,Scholastic
111,1077326,female,"Yate, South Gloucestershire, England","Harry Potter and the Order of the Phoenix (Harry Potter, #5)",0439358078,9780439358071,4.50,Scholastic Inc.
112,1077326,female,"Yate, South Gloucestershire, England","Harry Potter and the Half-Blood Prince (Harry Potter, #6)",{'@nil': 'true'},{'@nil': 'true'},4.57,Scholastic Inc.
113,1077326,female,"Yate, South Gloucestershire, England",The Tales of Beedle the Bard,0747599874,9780747599876,4.06,Bloomsbury
114,1077326,female,"Yate, South Gloucestershire, England","Harry Potter Series Box Set (Harry Potter, #1-7)",0545044251,9780545044257,4.73,Arthur A. Levine Books
115,1077326,female,"Yate, South Gloucestershire, England",The Casual Vacancy,0316228532,9780316228534,3.30,"Little, Brown and Company"
116,1077326,female,"Yate, South Gloucestershire, England","Harry Potter and the Order of the Phoenix (Harry Potter, #5, Part 1)",185549664X,9781855496644,4.62,BBC Audiobooks
117,1077326,female,"Yate, South Gloucestershire, England","Harry Potter and the Sorcerer's Stone (Harry Potter, #1)",{'@nil': 'true'},{'@nil': 'true'},4.47,Scholastic Inc
118,1077326,female,"Yate, South Gloucestershire, England","Harry Potter and the Prisoner of Azkaban (Harry Potter, #3)",043965548X,9780439655484,4.57,Scholastic Inc.
119,1077326,female,"Yate, South Gloucestershire, England","Harry Potter and the Chamber of Secrets (Harry Potter, #2)",0439064864,9780439064866,4.43,Arthur A. Levine Books / Scholastic Inc.
120,1077326,female,"Yate, South Gloucestershire, England","Harry Potter and the Goblet of Fire (Harry Potter, #4)",{'@nil': 'true'},{'@nil': 'true'},4.56,Scholastic
121,1077326,female,"Yate, South Gloucestershire, England","Harry Potter and the Order of the Phoenix (Harry Potter, #5)",0439358078,9780439358071,4.50,Scholastic Inc.
122,1077326,female,"Yate, South Gloucestershire, England","Harry Potter and the Half-Blood Prince (Harry Potter, #6)",{'@nil': 'true'},{'@nil': 'true'},4.57,Scholastic Inc.
123,1077326,female,"Yate, South Gloucestershire, England",The Tales of Beedle the Bard,0747599874,9780747599876,4.06,Bloomsbury
124,1077326,female,"Yate, South Gloucestershire, England","Harry Potter Series Box Set (Harry Potter, #1-7)",0545044251,9780545044257,4.73,Arthur A. Levine Books
125,1077326,female,"Yate, South Gloucestershire, England",The Casual Vacancy,0316228532,9780316228534,3.30,"Little, Brown and Company"
126,1077326,female,"Yate, South Gloucestershire, England","Harry Potter and the Order of the Phoenix (Harry Potter, #5, Part 1)",185549664X,9781855496644,4.62,BBC Audiobooks
127,5725556,male,"Manhattan, New York City, New York",Hamilton: The Revolution,1455539740,9781455539741,4.45,Grand Central Publishing
128,5725556,male,"Manhattan, New York City, New York","Gmorning, Gnight!: Little Pep Talks for Me & You",{'@nil': 'true'},{'@nil': 'true'},4.33,
129,5725556,male,"Manhattan, New York City, New York",In the Heights: The Complete Book and Lyrics,1476874646,9781476874647,4.46,Applause Theatre & Cinema Book Publishers
130,5725556,male,"Manhattan, New York City, New York",Hamilton: Vocal Selections,1495057542,9781495057540,4.66,Hal Leonard Publishing Corporation
131,5725556,male,"Manhattan, New York City, New York",Hamilton: Easy Piano Selections,1495069885,9781495069888,4.57,Hal Leonard Publishing Corporation
132,5725556,male,"Manhattan, New York City, New York",Moana: Music from the Motion Picture Soundtrack,1495083179,9781495083174,4.49,Hal Leonard Publishing Corporation
133,5725556,male,"Manhattan, New York City, New York",In the Heights: Vocal Selections,1423445813,9781423445814,4.49,Hal Leonard Publishing Corporation
134,5725556,male,"Manhattan, New York City, New York",Hamilton - 10 Selections from the Hit Musical: Music Minus One Vocals,1495071332,{'@nil': 'true'},4.50,
135,5725556,male,"Manhattan, New York City, New York",Hamilton: Strum & Sing Guitar,1495088383,9781495088384,4.37,Hal Leonard Publishing Corporation
136,5725556,male,"Manhattan, New York City, New York",Hamilton: Ukulele Selections,1495088200,9781495088209,4.37,Hal Leonard Publishing Corporation
137,4454736,female,"Chicago, IL","Goodnight, Goodnight, Construction Site",0811877825,9780811877824,4.35,Chronicle Books
138,4454736,female,"Chicago, IL","Steam Train, Dream Train",1452109206,9781452109206,4.15,Chronicle Books
139,4454736,female,"Chicago, IL","Mighty, Mighty Construction Site",1452152160,9781452152165,4.18,Chronicle Books
140,4454736,female,"Chicago, IL",Construction Site on Christmas Night,1452139113,9781452139111,4.16,Chronicle Books
141,4454736,female,"Chicago, IL",Big Machines: The Story of Virginia Lee Burton,0544715578,9780544715578,4.02,HMH Books for Young Readers
142,4454736,female,"Chicago, IL",Silly Wonderful You,0062271059,9780062271051,3.95,Balzer + Bray
143,4454736,female,"Chicago, IL",Three Cheers for Kid McGear!,1452155828,9781452155821,3.86,Chronicle Books
144,4454736,female,"Chicago, IL",The 12 Sleighs of Christmas,1452145148,9781452145143,3.73,Chronicle Books
145,4454736,female,"Chicago, IL","Steam Train, Dream Train Colors",1452149151,9781452149158,4.05,Chronicle Books
146,4454736,female,"Chicago, IL","Steam Train, Dream Train 1-2-3",1452149143,9781452149141,3.98,Chronicle Books
147,17835618,,"Redmond, Oregon",A Day in the Life of Marlon Bundo,{'@nil': 'true'},{'@nil': 'true'},4.64,
148,17835618,,"Redmond, Oregon",The Someone New,0062933744,9780062933744,4.26,HarperCollins
149,17835618,,"Redmond, Oregon",Everyone Gets a Say,0062933752,9780062933751,4.16,
150,17835618,,"Redmond, Oregon",Love Inc.,{'@nil': 'true'},{'@nil': 'true'},5.00,Razorbill
151,19794,male,"Cape Girardeau, Missouri","Rush Revere and the Brave Pilgrims (Adventures of Rush Revere, #1)",1476755914,9781476755915,4.11,Threshold Editions
152,19794,male,"Cape Girardeau, Missouri",The Way Things Ought to Be,0671751506,9780671751500,3.57,Pocket Books
153,19794,male,"Cape Girardeau, Missouri","See, I Told You So",0671871218,9780671871215,3.68,Pocket Books
154,19794,male,"Cape Girardeau, Missouri","Rush Revere and the First Patriots (Adventures with Rush Revere, #2)",1476755922,9781476755922,4.29,Threshold Editions
155,19794,male,"Cape Girardeau, Missouri","Rush Revere and the American Revolution (Adventures of Rush Revere, #3)",1476789878,9781476789873,4.34,Threshold Editions
156,19794,male,"Cape Girardeau, Missouri","Rush Revere and the Star-Spangled Banner (Adventures of Rush Revere, #4)",{'@nil': 'true'},{'@nil': 'true'},4.37,
157,19794,male,"Cape Girardeau, Missouri","Rush Revere and the Presidency (Adventures of Rush Revere, #5)",{'@nil': 'true'},{'@nil': 'true'},4.32,
158,19794,male,"Cape Girardeau, Missouri",Rush Revere and the Brave Pilgrims / Rush Revere and the First Patriots (Adventures of Rush Revere #1-2),8956607877,9788956607870,4.14,
159,19794,male,"Cape Girardeau, Missouri",The Further Adventures of Rush Revere #1-4 (Adventures of Rush Revere #1-4),1501158368,9781501158360,4.41,Threshold Editions
160,19794,male,"Cape Girardeau, Missouri",Adventures of Rush Revere #1-3 (Adventures of Rush Revere #1-3),1501137328,9781501137327,4.16,Threshold Editions
161,191218,female,"Los Angeles, California",Little Blue Truck,0152056610,9780152056612,4.50,HMH Books for Young Readers
162,191218,female,"Los Angeles, California",Little Blue Truck Leads the Way,0152063897,9780152063894,4.24,HMH Books for Young Readers
163,191218,female,"Los Angeles, California",Little Blue Truck's Christmas,0544320417,9780544320413,4.32,HMH Books for Young Readers
164,191218,female,"Los Angeles, California",Little Blue Truck's Halloween,0544772539,9780544772533,4.20,HMH Books for Young Readers
165,191218,female,"Los Angeles, California",All You Need for a Snowman,0152061150,9780152061159,3.93,HMH Books for Young Readers
166,191218,female,"Los Angeles, California",Little Blue Truck's Springtime,0544938097,9780544938090,3.83,HMH Books for Young Readers
167,191218,female,"Los Angeles, California","Good Night, Little Blue Truck",132885213X,9781328852137,4.22,HMH Books for Young Readers
168,191218,female,"Los Angeles, California",Such a Little Mouse,0545649293,9780545649292,4.03,Orchard Books
169,191218,female,"Los Angeles, California",Very Hairy Bear,0152165681,9780152165680,3.77,Harcourt
170,191218,female,"Los Angeles, California",Button Up!: Wrinkled Rhymes,0152050507,9780152050504,3.87,Harcourt Children's Books
171,141487,male,,Obama: An Intimate Portrait: The Historic Presidency in Photographs,0316512583,9780316512589,4.29,"Little, Brown and Company"
172,141487,male,,Shade: A Tale of Two Presidents,0316421820,9780316421829,4.05,"Little, Brown and Company"
173,141487,male,,Dream Big Dreams: Photographs from Barack Obama's Inspiring and Historic Presidency,031651439X,9780316514392,4.74,"Little, Brown Books for Young Readers"
174,141487,male,,The Rise of Barack Obama,1600781632,9781600781636,4.30,Triumph Books Entertainment
175,141487,male,,Images of Greatness: An Intimate Look at the Presidency of Ronald Reagan,1572437014,9781572437012,4.44,Triumph Books
176,141487,male,,Unguarded Moments: Behind the Scenes Photography of President Ronald Reagan,1930819374,9781930819375,4.15,
177,141487,male,,Plebe Summer at the U.S. Naval Academy: Photographs,0972942602,9780972942607,4.39,P. Souza
178,141487,male,,"[Obama: An Intimate Portrait, Deluxe Limited Edition]",8925597950,9788925597959,4.33,
179,141487,male,,The President's Photographer: Fifty Years Inside the Oval Office,1426206763,9781426206764,4.34,National Geographic
180,141487,male,,Ansel Adams' Yosemite: The Special Edition Prints,0316456128,9780316456128,4.81,Ansel Adams
181,311467,male,"Philadelphia, PA",Liberty and Tyranny: A Conservative Manifesto,1416562850,9781416562856,4.17,Threshold Editions
182,311467,male,"Philadelphia, PA",Rescuing Sprite: A Dog Lover's Story of Joy and Anguish,1416559132,9781416559139,3.93,Threshold Editions
183,311467,male,"Philadelphia, PA",Ameritopia: The Unmaking of America,{'@nil': 'true'},{'@nil': 'true'},4.26,
184,311467,male,"Philadelphia, PA",The Liberty Amendments: Restoring the American Republic,1451606273,9781451606270,4.31,Threshold Editions
185,311467,male,"Philadelphia, PA",Men in Black: How Judges are Destroying America,0895260506,9780895260505,4.17,Regnery Publishing
186,311467,male,"Philadelphia, PA",Unfreedom of the Press,{'@nil': 'true'},{'@nil': 'true'},4.12,
187,311467,male,"Philadelphia, PA",Plunder and Deceit: Big Government's Exploitation of Young People and the Future,1442390840,9781442390843,4.18,Simon  Schuster Audio
188,311467,male,"Philadelphia, PA",Rediscovering Americanism: And the Tyranny of Progressivism,{'@nil': 'true'},{'@nil': 'true'},4.09,
189,311467,male,"Philadelphia, PA",Liberty and Tyranny (Audio Book Unabridged Books on CD),1436175259,9781436175258,3.00,
190,311467,male,"Philadelphia, PA",SUMMARY OF UNFREEDOM OF THE PRESS By Mark Levin,1086533127,9781086533125,0.0,
191,221559,male,"Andrews Air Force Base, Maryland","Diary of a Wimpy Kid (Diary of a Wimpy Kid, #1)",0810993139,9780810993136,3.99,Amulet Books
192,221559,male,"Andrews Air Force Base, Maryland","Rodrick Rules (Diary of a Wimpy Kid, #2)",0810994739,9780810994737,4.14,Amulet Books
193,221559,male,"Andrews Air Force Base, Maryland","The Last Straw (Diary of a Wimpy Kid, #3)",0810970686,9780810970687,4.14,Amulet Books
194,221559,male,"Andrews Air Force Base, Maryland","Dog Days (Diary of a Wimpy Kid, #4)",0810983915,9780810983915,4.17,Amulet Books
195,221559,male,"Andrews Air Force Base, Maryland","The Ugly Truth (Diary of a Wimpy Kid, #5)",0810984911,9780810984912,4.19,Amulet books
196,221559,male,"Andrews Air Force Base, Maryland","Cabin Fever (Diary of a Wimpy Kid, #6)",1419702238,9781419702235,4.24,Amulet Books
