,author_id,gender,hometown,book_title,book_isbn,book_isbn13,book_average_rating,book_publisher
424,142845,female,,Hello Toes! Hello Feet!,0789426641,9780789426642,3.50,DK Publishing (Dorling Kindersley)
425,17348719,,,"I Am Confident, Brave & Beautiful: A Coloring Book for Girls",0692927999,9780692927991,4.28,
426,17348719,,,Outdoor Sports Sticker Book for Girls Ages 4-8,0692076034,9780692076033,3.67,
427,17348719,,,"Science! STEM Sticker Adventure - Sticker Activity Book For Girls Aged 4 to 8 - Over 125 Reusable Stickers - Space Exploration, Deep Sea Adventure, Dinosaur Dig & More",069215275X,9780692152751,5.00,
428,17348719,,,Think Brave! A Coloring & Drawing Adventure - Coloring Book for Girls,1734287624,9781734287622,0.0,
429,17348719,,,"I'm Me! Journal for Girls - Lined Blank Diary, Writing Pad, Writing Gift for Self-Exploration, Mindfulness, Gratitude, Life and More",1734287616,9781734287615,0.0,
430,17348719,,,"I'm Me! Sketchbook for Girls - Blank Hardcover Notebook, Journal, Drawing Pad, Sketch Book",1734287608,9781734287608,0.0,
431,15872,male,"San Antonio, Texas","The Lightning Thief (Percy Jackson and the Olympians, #1)",0786838655,9780786838653,4.26,Disney Hyperion Books
432,15872,male,"San Antonio, Texas","The Battle of the Labyrinth (Percy Jackson and the Olympians, #4)",{'@nil': 'true'},{'@nil': 'true'},4.39,Hyperion Books for Children
433,15872,male,"San Antonio, Texas","The Sea of Monsters (Percy Jackson and the Olympians, #2)",0786856866,9780786856862,4.24,Hyperion Books
434,15872,male,"San Antonio, Texas","The Titan's Curse (Percy Jackson and the Olympians, #3)",0141382899,9780141382890,4.34,Puffin Books
435,15872,male,"San Antonio, Texas","The Mark of Athena (The Heroes of Olympus, #3)",1423140605,9781423140603,4.45,Disney-Hyperion Books
436,15872,male,"San Antonio, Texas","The Last Olympian (Percy Jackson and the Olympians, #5)",1423101472,9781423101475,4.50,Disney ● Hyperion Books
437,15872,male,"San Antonio, Texas","The Lost Hero (The Heroes of Olympus, #1)",142311339X,9781423113393,4.33,Disney ● Hyperion Books
438,15872,male,"San Antonio, Texas","The Son of Neptune (The Heroes of Olympus, #2)",1423140591,9781423140597,4.43,Disney ● Hyperion Books
439,15872,male,"San Antonio, Texas","The Red Pyramid (The Kane Chronicles, #1)",1423113381,9781423113386,4.08,Disney-Hyperion
440,15872,male,"San Antonio, Texas","The House of Hades (The Heroes of Olympus, #4)",1423146727,9781423146728,4.54,Disney-Hyperion Books
441,4489,male,"Brooklyn, New York",Where the Wild Things Are,0099408392,9780099408390,4.22,Red Fox
442,4489,male,"Brooklyn, New York",Chicken Soup with Rice: A Book of Months,006443253X,9780064432535,4.23,HarperCollins
443,4489,male,"Brooklyn, New York",In the Night Kitchen,0099417472,9780099417477,4.01,Red Fox
444,4489,male,"Brooklyn, New York",Pierre: A Cautionary Tale in Five Chapters and a Prologue,0064432521,9780064432528,4.28,HarperCollins
445,4489,male,"Brooklyn, New York",Outside Over There,0064431851,9780064431859,3.90,HarperCollins
446,4489,male,"Brooklyn, New York",Nutshell Library,0060255005,9780060255008,4.58,HarperCollins
447,4489,male,"Brooklyn, New York",Alligators All Around,0064432548,9780064432542,4.08,HarperCollins
448,4489,male,"Brooklyn, New York",Higglety Pigglety Pop! or There Must Be More to Life,006028479X,9780060284794,4.19,HarperCollins
449,4489,male,"Brooklyn, New York",One Was Johnny: A Counting Book,0064432513,9780064432511,4.20,HarperCollins
450,4489,male,"Brooklyn, New York",My Brother's Book,0062234897,9780062234896,3.67,HarperCollins
451,20376761,,,"The Body Keeps the Score: Brain, Mind, and Body in the Healing of Trauma",{'@nil': 'true'},{'@nil': 'true'},4.00,
452,20376761,,,"The Body Keeps the Score: Brain, Mind, and Body in the Healing of Trauma",{'@nil': 'true'},{'@nil': 'true'},0.0,
453,20376761,,,"The Body Keeps the Score: Brain, Mind, and Body in the Healing of Trauma",{'@nil': 'true'},{'@nil': 'true'},0.0,
454,14980616,female,Kansas,Homebody: A Guide to Creating Spaces You Never Want to Leave,006280197X,9780062801975,4.01,Harper Design
455,14980616,female,Kansas,Magnolia Table: A Collection of Recipes for Gathering,006282015X,9780062820150,4.20,WILLIAM MORROW
456,14980616,female,Kansas,We Are the Gardeners,1400314224,9781400314225,4.26,Thomas Nelson
457,14980616,female,Kansas,"Magnolia Table, Volume 2: A Collection of Recipes for Gathering",{'@nil': 'true'},{'@nil': 'true'},4.37,William Morrow Cookbooks
458,14980616,female,Kansas,Homebody / Magnolia Table,8925599376,9788925599373,4.33,
459,14980616,female,Kansas,The World Needs Who You Were Made to Be,1400314232,9781400314232,4.44,Thomas Nelson
460,14980616,female,Kansas,We Are the Gardeners Educator's Guide,{'@nil': 'true'},{'@nil': 'true'},5.00,
461,14980616,female,Kansas,Magnolia Table / Tasty & Healthy / Slow Cooker Spice-Guy Curry Diet Recipe Book / The Vegan Longevity Diet,9123736062,9789123736065,3.00,
462,14980616,female,Kansas,Magnolia Journal,{'@nil': 'true'},{'@nil': 'true'},4.00,
463,14980616,female,Kansas,Unser Garten blüht: Wie ein Farn in unser Haus zog und unsere Liebe zum Gärtnern weckte,{'@nil': 'true'},{'@nil': 'true'},0.0,
464,7115158,male,,One More Thing: Stories and Other Stories,0385351836,9780385351836,3.68,Knopf
465,7115158,male,,The Book with No Pictures,0803741715,9780803741713,4.34,Dial Books
466,7115158,male,,The Man Who Invented the Calendar: Three Stories from One More Thing,{'@nil': 'true'},{'@nil': 'true'},3.85,
467,7115158,male,,My Book with No Pictures,059311101X,9780593111017,4.33,
468,7115158,male,,A Good Problem to Have,{'@nil': 'true'},{'@nil': 'true'},4.30,
469,7115158,male,,"Die Zeit im Himmel ist knapp, und alle sind sehr beschäftigt",{'@nil': 'true'},{'@nil': 'true'},3.50,
470,7115158,male,,Kellogg's,{'@nil': 'true'},{'@nil': 'true'},4.17,
471,7115158,male,,All You Have to Do,{'@nil': 'true'},{'@nil': 'true'},3.83,
472,7115158,male,,Missed Connection,{'@nil': 'true'},{'@nil': 'true'},3.80,
473,7115158,male,,"Humor Short Story Playlist: ""No One Goes to Heaven to See Dan Fogelberg"" from ONE MORE THING",{'@nil': 'true'},{'@nil': 'true'},5.00,Penguin Random House Audio
474,486329,male,,The Boys in the Boat: Nine Americans and Their Epic Quest for Gold at the 1936 Berlin Olympics,067002581X,9780670025817,4.35,Viking
475,486329,male,,The Indifferent Stars Above: The Harrowing Saga of a Donner Party Bride,0061348104,9780061348105,4.19,William Morrow
476,486329,male,,Under a Flaming Sky: The Great Hinckley Firestorm of 1894,006123625X,9780061236259,4.09,
477,486329,male,,Facing the Mountain: A True Story of Japanese American Heroes in World War II,0525531181,9780525531180,0.0,Penguin Audiobooks
478,486329,male,,Remando como un solo hombre (Narración en Castellano): La historia del equipo de remo que humilló a Hitler,171358705X,9781713587057,0.0,Audible Studios on Brilliance Audio
479,486329,male,,The Boys in the Boat: The True Story of an American Team's Epic Journey to Win Gold at the 1936 Olympics,0451475925,9780451475923,4.40,Viking Books for Young Readers
480,2331,,"Passaic, New Jersey",Tuesdays with Morrie,0751529818,9780751529814,4.11,Warner
481,2331,,"Passaic, New Jersey",The Five People You Meet in Heaven,1401308589,9781401308582,3.94,Hyperion
482,2331,,"Passaic, New Jersey",For One More Day,1401303277,9781401303273,4.10,Hachette Books
483,2331,,"Passaic, New Jersey",The Time Keeper,1401322786,9781401322786,3.87,Hachette Books
484,2331,,"Passaic, New Jersey",Have a Little Faith: a True Story,0786868724,9780786868728,4.17,Hachette Books
485,2331,,"Passaic, New Jersey",The First Phone Call from Heaven,0062294377,9780062294371,3.75,Harper
486,2331,,"Passaic, New Jersey",The Next Person You Meet in Heaven,{'@nil': 'true'},{'@nil': 'true'},4.30,
487,2331,,"Passaic, New Jersey",The Magic Strings of Frankie Presto,{'@nil': 'true'},{'@nil': 'true'},4.34,Harper
488,2331,,"Passaic, New Jersey","Finding Chika: A Little Girl, an Earthquake, and the Making of a Family",{'@nil': 'true'},{'@nil': 'true'},4.45,
489,2331,,"Passaic, New Jersey","Fab Five: Basketball, Trash Talk, the American Dream",0446601195,9780446601191,4.28,Grand Central Publishing
490,159300,male,"San Francisco, California",Ship of Fools: How a Selfish Ruling Class Is Bringing America to the Brink of Revolution,{'@nil': 'true'},{'@nil': 'true'},4.30,Free Press
491,159300,male,"San Francisco, California","Politicians, Partisans, and Parasites: My Adventures in Cable News",0446529761,9780446529761,3.93,Warner Books (NY)
492,159300,male,"San Francisco, California",People Vs. Crime: How Citizens Can Restore Order to America's Streets,0761506713,9780761506713,3.00,Prima Publishing
493,159300,male,"San Francisco, California","Stone's Rules: How to Win at Politics, Business, and Style",1510740090,9781510740099,3.65,Skyhorse
494,159300,male,"San Francisco, California",The Dadly Virtues: Adventures from the Worst Job You'll Ever Love,1599474891,9781599474892,3.84,Templeton Press
495,159300,male,"San Francisco, California",The Weekly Standard: A Reader: 1995-2005,0060882859,9780060882853,3.64,Harper Perennial
496,1943477,female,"Jackson, Mississippi",The Help,{'@nil': 'true'},{'@nil': 'true'},4.46,Amy Einhorn Books/G.P. Putnam's Sons
497,1943477,female,"Jackson, Mississippi",La couleur des sentiments : Tome 2,2848683732,9782848683737,4.43,
498,1943477,female,"Jackson, Mississippi","Of Love and Life: Love Affairs for Grown-Ups / The Help / Water, Stone, Heart",0276444442,9780276444449,3.98,Reader's Digest
499,1943477,female,"Jackson, Mississippi",CliffsNotes on Stockett's The Help (CliffsNotes),1455888133,9781455888139,4.00,Brilliance Audio
500,216562,male,,Dear Zoo: A Lift-the-Flap Book,141694737X,9781416947370,4.28,Little Simon
501,216562,male,,Dear Santa,0230739415,9780230739413,4.10,MacMillan Children's Books
502,216562,male,,Oh Dear!,0333781392,9780333781395,4.25,Campbell Books
503,216562,male,,Dear Zoo Animal Shapes,023076083X,9780230760837,3.40,MacMillan Children's Books
504,216562,male,,Buster's Zoo: A Touch-And-Feel Book,023074169X,9780230741690,4.17,MacMillan Children's Books
505,216562,male,,Noisy Farm,0140502939,9780140502930,3.91,Puffin Books
506,216562,male,,Dinosaurs,1481449850,9781481449854,3.07,Little Simon
507,216562,male,,Farm 123,1405020091,9781405020091,3.95,Campbell Books
508,216562,male,,I Won't Bite!,0333781198,9780333781197,4.06,Macmillan Children's Books
509,216562,male,,It's Mine!,0333762789,9780333762783,4.22,Macmillan UK
510,3465,female,"Pasadena, California",My Life in France,1400043468,9781400043460,4.16,Knopf Publishing Group
511,3465,female,"Pasadena, California",Mastering the Art of French Cooking,0375413405,9780375413407,4.28,Knopf Publishing Group
512,3465,female,"Pasadena, California",The Way to Cook,0679747656,9780679747659,4.31,Knopf
513,3465,female,"Pasadena, California","Baking with Julia: Sift, Knead, Flute, Flour, and Savor...",{'@nil': 'true'},9780688146573,4.27,William Morrow Cookbooks
514,3465,female,"Pasadena, California",Mastering the Art of French Cooking: Vol. 2,0394721772,9780394721774,4.42,Knopf
515,3465,female,"Pasadena, California",Julia and Jacques Cooking at Home,0375404317,9780375404313,4.25,Knopf Publishing Group
516,3465,female,"Pasadena, California",The French Chef Cookbook,030729045X,9780307290458,4.38,Alfred A. Knopf Incorporated
517,3465,female,"Pasadena, California",Julia's Kitchen Wisdom: Essential Techniques and Recipes from a Lifetime of Cooking,0375411518,9780375411519,4.19,Knopf
518,3465,female,"Pasadena, California",Mastering the Art of French Cooking: Vol. 1,0394721780,9780394721781,4.41,Knopf
519,3465,female,"Pasadena, California","As Always, Julia: The Letters of Julia Child and Avis DeVoto: Food, Friendship, and the Making of a Masterpiece",0547417713,9780547417714,4.13,Houghton Mifflin
520,821537,female,,The Pout-Pout Fish,0374360960,9780374360962,4.31,"Farrar, Straus and Giroux"
521,821537,female,,The Pout-Pout Fish in the Big-Big Dark,0374307989,9780374307981,4.11,"Farrar, Straus and Giroux"
522,821537,female,,The Pout-Pout Fish Goes to School,0374360952,9780374360955,4.00,"Farrar, Straus and Giroux"
523,821537,female,,Picture Day Perfection,1419708449,9781419708442,3.84,Harry N. Abrams
524,821537,female,,The Not Very Merry Pout-Pout Fish,0374355495,9780374355494,3.80,"Farrar, Straus and Giroux"
525,821537,female,,"Smile, Pout-Pout Fish",0374370842,9780374370848,3.80,"Farrar, Straus and Giroux (BYR)"
526,821537,female,,"The Pout-Pout Fish, Far, Far from Home",0374301948,9780374301941,3.75,"Farrar, Straus and Giroux"
527,821537,female,,The Pout-Pout Fish and the Bully-Bully Shark,0374304025,9780374304027,3.77,"Farrar, Straus and Giroux"
528,821537,female,,"Sweet Dreams, Pout-Pout Fish",0374380104,9780374380106,3.84,"Farrar, Straus and Giroux (BYR)"
529,821537,female,,Bloom,0374302502,9780374302504,3.52,"Farrar, Straus and Giroux (BYR)"
530,6252,male,"Charleston, South Carolina","The Eye of the World (The Wheel of Time, #1)",0812511816,9780812511819,4.17,Tor Books
531,6252,male,"Charleston, South Carolina","The Great Hunt (The Wheel of Time, #2)",0812517725,9780812517729,4.22,Tor Books
532,6252,male,"Charleston, South Carolina","The Dragon Reborn (The Wheel of Time, #3)",0765305119,9780765305114,4.25,Tor Books
533,6252,male,"Charleston, South Carolina","The Shadow Rising (The Wheel of Time, #4)",0812513738,9780812513738,4.23,Tom Doherty Tor Fantasy
534,6252,male,"Charleston, South Carolina","The Gathering Storm (The Wheel of Time, #12)",0765302306,9780765302304,4.36,Tor Books
535,6252,male,"Charleston, South Carolina","Towers of Midnight (The Wheel of Time, #13)",0765325942,9780765325945,4.42,Tom Doherty Associates TOR Fantasy
536,6252,male,"Charleston, South Carolina","The Fires of Heaven (The Wheel of Time, #5)",1857232097,9781857232097,4.15,Orbit
537,6252,male,"Charleston, South Carolina","Lord of Chaos (The Wheel of Time, #6)",0812513754,9780812513752,4.13,Tor Books
538,6252,male,"Charleston, South Carolina","A Crown of Swords (The Wheel of Time, #7)",0812550285,9780812550283,4.03,Tor Books
539,6252,male,"Charleston, South Carolina","A Memory of Light (The Wheel of Time, #14)",0765325950,9780765325952,4.50,Tor Books
540,2658,female,"Brooklyn, New York",Barefoot Contessa at Home: Everyday Recipes You'll Make Over and Over Again,1400054346,9781400054343,4.12,Clarkson Potter Publishers
541,2658,female,"Brooklyn, New York",The Barefoot Contessa Cookbook,0609602195,9780609602195,4.13,Clarkson Potter
542,2658,female,"Brooklyn, New York",Barefoot Contessa Back to Basics,1400054354,9781400054350,4.13,Clarkson Potter
543,2658,female,"Brooklyn, New York",Barefoot Contessa Family Style: Easy Ideas and Recipes That Make Everyone Feel Like Family,060961066X,9780609610664,4.15,Clarkson Potter
544,2658,female,"Brooklyn, New York",Barefoot in Paris,1400049350,9781400049356,4.11,Clarkson Potter
545,2658,female,"Brooklyn, New York",Barefoot Contessa: How Easy Is That?,0307238768,9780307238764,4.25,Clarkson Potter
546,2658,female,"Brooklyn, New York",Barefoot Contessa Parties!: Ideas and Recipes for Easy Parties That Are Really Fun,0609606441,9780609606445,4.21,Clarkson Potter
547,2658,female,"Brooklyn, New York",Barefoot Contessa Foolproof: Recipes You Can Trust,0307464873,9780307464873,4.28,Clarkson Potter
548,2658,female,"Brooklyn, New York",Make It Ahead: A Barefoot Contessa Cookbook,0307464881,9780307464880,4.14,Clarkson Potter
549,2658,female,"Brooklyn, New York",Cooking for Jeffrey: A Barefoot Contessa Cookbook,0804187037,9780804187039,4.19,Clarkson Potter
550,1825,female,"Monroeville, Alabama",To Kill a Mockingbird,{'@nil': 'true'},{'@nil': 'true'},4.28,Harper Perennial Modern Classics
551,1825,female,"Monroeville, Alabama",Go Set a Watchman,0062409859,9780062409850,3.32,HarperCollins
552,1825,female,"Monroeville, Alabama",The Harper Lee Collection: To Kill a Mockingbird + Go Set a Watchman,0062423355,9780062423351,4.07,Harper
553,1825,female,"Monroeville, Alabama","Countdown to Go Set a Watchman: A Celebration of To Kill a Mockingbird, Sampler",{'@nil': 'true'},{'@nil': 'true'},3.71,
554,1825,female,"Monroeville, Alabama",Best Sellers from Reader's Digest Condensed Books: To Kill a Mockingbird / The Shoes of the Fisherman / Seven Days in May / To Catch an Angel,{'@nil': 'true'},{'@nil': 'true'},3.90,Reader's Digest Association
555,1825,female,"Monroeville, Alabama",Ne tirez pas sur l'oiseau moqueur (Edition pédagogique),2253259705,9782253259701,3.93,
556,1825,female,"Monroeville, Alabama",Harper Lee Collection 2 Books Set,9123956623,9789123956623,3.71,
557,1825,female,"Monroeville, Alabama",Il buio oltre la siepe: Edizione per ragazzi,{'@nil': 'true'},{'@nil': 'true'},2.79,
558,1825,female,"Monroeville, Alabama",Ne tirez pas sur l'oiseau moqueur - Roman graphique : Illustré et adapté par Fred Fordham,{'@nil': 'true'},{'@nil': 'true'},2.89,
559,1825,female,"Monroeville, Alabama",Matar a un ruiseñor,{'@nil': 'true'},{'@nil': 'true'},3.80,Harper Collins Ibérica
560,2338628,,"Chicago, Illinois",Becoming,{'@nil': 'true'},{'@nil': 'true'},4.53,Crown
561,2338628,,"Chicago, Illinois",American Grown: The Story of the White House Kitchen Garden and Gardens Across America,0307956024,9780307956026,3.95,Crown
562,2338628,,"Chicago, Illinois",Becoming: A Guided Journal for Discovering Your Voice,0241444152,9780241444153,4.48,
563,2338628,,"Chicago, Illinois",Michelle Obama: In Her Own Words,1440470960,9781440470967,3.95,Createspace
564,2338628,,"Chicago, Illinois","Michelle Obama: Speeches on Life, Love, and American Values",0982375638,9780982375631,4.36,Pacific Publishing Studio
565,2338628,,"Chicago, Illinois",Michelle Obama's Speech at the Democratic National Convention: Complete Text,{'@nil': 'true'},{'@nil': 'true'},4.21,ObamaQuotes.com
566,2338628,,"Chicago, Illinois",Michelle Obama: Speeches by the First Lady,{'@nil': 'true'},9781622970094,4.31,
567,2338628,,"Chicago, Illinois",Believe in the Possibility: The Words of Michelle Obama,1416207996,9781416207993,4.21,Sellers Publishing
568,2338628,,"Chicago, Illinois",The Farewell Addresses,{'@nil': 'true'},{'@nil': 'true'},4.41,
569,2338628,,"Chicago, Illinois",First Lady Michelle Obama: Remarks!,1441408371,9781441408372,4.25,Createspace
570,1093919,,,Creative Haven Owls Coloring Book,0486796647,9780486796642,4.33,Dover Publications
571,1093919,,,Creative Haven Creative Cats Coloring Book,0486789640,9780486789644,4.24,Dover Publications
572,1093919,,,Creative Haven Dazzling Dogs Coloring Book,0486803821,9780486803821,4.36,Dover Publications
573,1093919,,,151 Uncommon and Amazing Art Studio Secrets,{'@nil': 'true'},9780983740421,3.61,
574,1093919,,,Creative Haven Creative Kittens Coloring Book,0486812677,9780486812670,4.62,Dover Publications
575,1093919,,,Creative Haven Fanciful Foxes Coloring Book,0486806197,9780486806198,4.75,Dover Publications
576,1093919,,,Fanciful Fashions Coloring Book,0983740445,9780983740445,4.62,JR Imagination
577,1093919,,,Marjorie Sarnat's Pampered Pets: New York Times Bestselling Artists' Adult Coloring Books,1510712577,9781510712577,4.62,Racehorse
578,1093919,,,210 Imaginative Ideas for Painting: How to Find and Keep Your Inspiration and Advance Your Visual Style,{'@nil': 'true'},9780989318952,3.83,
579,1093919,,,Elegant Elephants Adult Coloring Book,0989318982,9780989318983,4.69,JR Imagination
580,3078,male,"Brooklyn, New York",Being Mortal: Medicine and What Matters in the End,0805095152,9780805095159,4.43,Metropolitan Books
581,3078,male,"Brooklyn, New York",The Checklist Manifesto: How to Get Things Right,0805091742,9780805091748,4.05,Metropolitan Books
582,3078,male,"Brooklyn, New York",Complications: A Surgeon's Notes on an Imperfect Science,0312421702,9780312421700,4.25,Picador USA
583,3078,male,"Brooklyn, New York",Better: A Surgeon's Notes on Performance,0805082115,9780805082111,4.24,Metropolitan Books
584,3078,male,"Brooklyn, New York",The Best American Science Writing 2006,006072644X,9780060726447,4.08,Ecco
585,3078,male,"Brooklyn, New York",Suntem muritori. Ce contează cu adevărat la sfârşitul vieţii,{'@nil': 'true'},9786063340185,4.06,Litera
586,3078,male,"Brooklyn, New York","Atul Gawande Collection 4 Books Set (The Checklist Manifesto, Being Mortal, Complications, Better a Surgeon's Notes on Performance)",9123791861,9789123791866,4.71,
587,3078,male,"Brooklyn, New York",Guérir. Faillir,{'@nil': 'true'},{'@nil': 'true'},4.43,
588,3078,male,"Brooklyn, New York",Jiv Jithe Guntalela,8184984790,{'@nil': 'true'},4.60,
589,3078,male,"Brooklyn, New York",Чек-лист. Система предотвращения ошибок,{'@nil': 'true'},9785961463316,4.67,Альпина Паблишер
590,19722899,male,Clyde,The Wonky Donkey,1869439260,9781869439262,4.39,Scholastic New Zealand
591,19722899,male,Clyde,The Dinky Donkey,1338600834,9781338600834,4.16,Scholastic Inc.
592,19722899,male,Clyde,Willbee The Bumblebee,{'@nil': 'true'},9781775431633,3.93,Scholastic Australia Pty Limited
593,19722899,male,Clyde,My daddy ate an apple,{'@nil': 'true'},9781775432005,3.95,Scholastic
594,19722899,male,Clyde,The Grinny Granny Donkey,1338692275,9781338692273,4.31,Scholastic Inc.
595,19722899,male,Clyde,The Scariest Thing in the Garden,{'@nil': 'true'},9781775435051,4.20,Scholastic New Zealand
596,19722899,male,Clyde,Square Eyes,{'@nil': 'true'},9781775432692,4.14,scholastic
597,19722899,male,Clyde,Remarkably Rexy,1760113948,9781760113940,3.61,Allen & Unwin
598,19722899,male,Clyde,Kaha the kea,{'@nil': 'true'},9780473213503,3.78,Craig Smith
599,19722899,male,Clyde,Eating,{'@nil': 'true'},9780473328351,3.75,Craig Smith Publishing
600,17977069,male,,Can't Hurt Me: Master Your Mind and Defy the Odds,{'@nil': 'true'},{'@nil': 'true'},4.40,
601,17977069,male,,"Cant hurt me, unfck yourself, you are a badass, you are a badass at making money 4 books collection set",9123765666,9789123765669,4.37,
602,17977069,male,,Built Not Born,006287571X,9780062875716,4.26,HarperOne
603,17977069,male,,"Can't Hurt Me Master Your Mind and Defy the Odds, Rewire Your Mindset, The Fitness Mindset, Meltdown 4 Books Collection Set",9123985585,9789123985586,4.58,
604,2884275,female,,The Pioneer Woman Cooks: Recipes from an Accidental Country Girl,0061658197,9780061658198,4.11,William Morrow Cookbooks
605,2884275,female,,The Pioneer Woman Cooks: Food from My Frontier,0061997188,9780061997181,4.20,William Morrow Cookbooks
606,2884275,female,,The Pioneer Woman: Black Heels to Tractor Wheels,0061997161,9780061997167,3.83,William Morrow
607,2884275,female,,"The Pioneer Woman Cooks: Dinnertime: Comfort Classics, Freezer Food, 16-Minute Meals, and Other Delicious Ways to Solve Supper!",0062225243,9780062420725,4.31,William Morrow Cookbooks
608,2884275,female,,The Pioneer Woman Cooks: A Year of Holidays,0062225227,9780062225221,4.35,William Morrow Cookbooks
609,2884275,female,,Charlie the Ranch Dog,0061996556,9780061996559,4.11,HarperCollins
610,2884275,female,,"The Pioneer Woman Cooks: Come and Get It! Simple, Scrumptious Recipes for Crazy Busy Lives",006222526X,9780062225269,4.08,William Morrow Cookbooks
611,2884275,female,,The Pioneer Woman Cooks: The New Frontier,0062561383,9780062561381,4.08,William Morrow Cookbooks
612,2884275,female,,Charlie and the Christmas Kitty,0061996572,9780061996573,3.92,HarperCollins
613,2884275,female,,Charlie the Ranch Dog: Where's the Bacon?,0062254111,9780062254115,4.02,HarperCollins
614,30913,female,"Fairfax, Virginia","Unbroken: A World War II Story of Survival, Resilience and Redemption",1400064163,9781400064168,4.36,Random House
615,30913,female,"Fairfax, Virginia",Seabiscuit: An American Legend,0345465083,9780345465085,4.21,Ballantine Books
616,30913,female,"Fairfax, Virginia",Unbroken: An Olympian's Journey from Airman to Castaway to Captive,0385742517,9780385742511,4.57,Delacorte Press
617,30913,female,"Fairfax, Virginia",Unbroken Vol.2,8950956829,9788950956820,3.82,
618,30913,female,"Fairfax, Virginia",Unbroken Vol.1,8950956810,9788950956813,4.06,
619,30913,female,"Fairfax, Virginia",unbroken,{'@nil': 'true'},{'@nil': 'true'},3.62,
620,30913,female,"Fairfax, Virginia",Seabiscuit: The Screenplay,0345471156,9780345471154,4.23,Ballantine Books
621,69521,,,The Love Dare,0805448659,9780805448658,4.39,B Books
622,69521,,,The Resolution for Men,1433671220,9781433671227,4.38,B Books
623,69521,,,The Battle Plan for Prayer: Attacking Life's Struggles Through Prayer,1433688662,9781433688669,4.50,B&H Books
624,69521,,,The Love Dare Day by Day: A Year of Devotions for Couples,1433668238,9781433668234,4.41,B Books
625,69521,,,War Room Member Book,1430040351,9781430040354,4.55,B&H Books
626,69521,,,The Love Dare for Parents,1433668521,9781433668524,4.43,B Books
627,69521,,,Night Watch: A Long-Lost Adventure in Which Sherlock Holmes Meets Father Brown,0375403671,9780375403675,3.50,Pantheon Books
628,69521,,,The Battle Plan for Prayer: From Basic Training to Targeted Strategies,{'@nil': 'true'},{'@nil': 'true'},4.57,
629,69521,,,Defined: Who God Says You Are,1535948922,9781535948920,4.40,B Books
630,69521,,,The Battle Plan Prayer Journal,0805489479,9780805489477,4.39,B Books
631,9950,male,"Brooklyn, New York City",Alexander Hamilton,{'@nil': 'true'},{'@nil': 'true'},4.20,Penguin Books
632,9950,male,"Brooklyn, New York City",Washington: A Life,1594202664,9781594202667,4.09,Penguin Press
633,9950,male,"Brooklyn, New York City","Titan: The Life of John D. Rockefeller, Sr.",1400077303,9781400077304,4.15,Vintage
634,9950,male,"Brooklyn, New York City",Grant,159420487X,9781594204876,4.46,Penguin Press
635,9950,male,"Brooklyn, New York City",The House of Morgan: An American Banking Dynasty and the Rise of Modern Finance,0802138292,9780802138293,3.95,Grove Press
636,9950,male,"Brooklyn, New York City",The Warburgs: The Twentieth-Century Odyssey of a Remarkable Jewish Family,0679743596,9780679743590,4.11,Vintage
