,author_id,gender,hometown,book_title,book_isbn,book_isbn13,book_average_rating,book_publisher
1701,18738769,,,"Eat for Life: The Breakthrough Nutrient-Rich Program for Longevity, Disease Reversal, and Sustained Weight Loss",0062249312,9780062249319,4.00,HarperOne
1702,18738769,,,"Eat for Life: The Breakthrough Nutrient-Rich Program for Longevity, Disease Reversal, and Sustained Weight Loss",0062249304,9780062249302,0.0,HarperOne
1703,18738769,,,Starved to Obesity: My Journey Out of Food Addiction and How You Can Escape It Too!,{'@nil': 'true'},9781642930528,3.67,
1704,348878,male,,"The Maze Runner (The Maze Runner, #1)",0385737947,9780385737944,4.03,Delacorte Press
1705,348878,male,,"The Scorch Trials (The Maze Runner, #2)",0385738757,9780385738750,3.91,Delacorte Press
1706,348878,male,,"The Death Cure (The Maze Runner, #3)",0385738773,9780385738774,3.77,Delacorte Books for Young Readers
1707,348878,male,,"The Kill Order (The Maze Runner, #4)",0385742886,9780385742887,3.71,Delacorte Books for Young Readers
1708,348878,male,,"The Eye of Minds (The Mortality Doctrine, #1)",0385741391,9780385741392,3.85,Delacorte Books for Young Readers
1709,348878,male,,"The Fever Code (The Maze Runner, #5)",0553513095,9780553513097,4.10,Delacorte Press
1710,348878,male,,"The Rule of Thoughts (The Mortality Doctrine, #2)",0385741413,9780385741415,3.99,Delacorte Press
1711,348878,male,,"The Journal of Curious Letters (The 13th Reality, #1)",1590388313,9781590388310,3.94,Shadow Mountain
1712,348878,male,,"The Hunt for Dark Infinity (The 13th Reality, #2)",1606410342,9781606410349,3.97,Shadow Mountain
1713,348878,male,,"The Maze Runner Trilogy (Maze Runner, #1-3)",0385373791,9780385373791,4.19,Delacorte Press
1714,95742,,,Diagnostic and Statistical Manual of Mental Disorders DSM-IV-TR,0890420254,9780890420256,3.88,American Psychiatric Publishing
1715,95742,,,Diagnostic and Statistical Manual of Mental Disorders (DSM-5),0890425558,9780890425558,4.17,American Psychiatric Association Publishing
1716,95742,,,Desk Reference to the Diagnostic Criteria from Dsm-5,0890425566,9780890425565,4.13,American Psychiatric Publishing
1717,95742,,,Quick Reference to the Diagnostic Criteria from DSM-IV-TR,0890420262,9780890420263,4.08,American Psychiatric Publishing
1718,95742,,,Diagnostic and Statistical Manual of Mental Disorders DSM-IV,0890420629,9780890420621,3.94,American Psychiatric Publishing
1719,95742,,,"Diagnostic and Statistical Manual of Mental Disorders, Text Revision: DSM-IV-TR",8184485425,9788184485424,4.08,
1720,95742,,,Dsm-5(r) Repositionable Page Markers,0890425582,9780890425589,4.20,American Psychiatric Publishing
1721,95742,,,Understanding Mental Disorders: Your Guide to DSM-5®,1585624918,9781585624911,4.08,American Psychiatric Publishing
1722,95742,,,"Diagnostic and Statistical Manual of Mental Disorders, Dsm-III-R",089042019X,9780890420195,4.02,American Psychiatric Publishing
1723,95742,,,Desk Reference to the Diagnostic Criteria from DSM-IV,0890420645,9780890420645,4.35,American Psychiatric Publishing
1724,106,female,"New York City, New York","A Wrinkle in Time (Time Quintet, #1)",1250153271,9781250153272,4.00,Square Fish
1725,106,female,"New York City, New York","A Wind in the Door (Time Quintet, #2)",{'@nil': 'true'},9780440487616,4.00,Dell Laurel-Leaf
1726,106,female,"New York City, New York","A Swiftly Tilting Planet (Time Quintet, #3)",0440401585,9780440401582,4.09,"Dell Publishing Co., Inc."
1727,106,female,"New York City, New York","Many Waters (Time Quintet, #4)",0312368577,9780312368579,3.97,Square Fish
1728,106,female,"New York City, New York","A Ring of Endless Light (Austin Family Chronicles, #4)",0440910811,9780440910817,4.16,Bantam Doubleday Dell Publishing Group
1729,106,female,"New York City, New York","An Acceptable Time (Time Quintet, #5)",0440208149,9780440208143,3.81,Laurel Leaf Books
1730,106,female,"New York City, New York","The Time Quartet Box Set (Time Quartet, #1-4)",0440360374,9780440360377,4.35,
1731,106,female,"New York City, New York","The Arm of the Starfish (O'Keefe Family, #1)",0440901839,9780440901839,3.85,Laurel Leaf Library
1732,106,female,"New York City, New York","Meet the Austins (Austin Family Chronicles, #1)",0374349290,9780374349295,3.85,"Farrar, Straus and Giroux (BYR)"
1733,106,female,"New York City, New York",Walking on Water: Reflections on Faith and Art,087788918X,9780877889182,4.26,Waterbrook Press
1734,2484,male,,"Eat This, Not That!: The No-Diet Weight Loss Solution",1594868549,9781594868542,3.71,Rodale Books
1735,2484,male,,"Eat This, Not That! Supermarket Survival Guide",1605298387,9781605298382,3.86,Rodale Books
1736,2484,male,,"Cook This, Not That!: Kitchen Survival Guide",160529442X,9781605294421,3.97,Rodale Books
1737,2484,male,,The Abs Diet: The Six-Week Plan to Flatten Your Stomach and Keep You Lean for Life,1594862168,9781594862168,3.80,Rodale Books
1738,2484,male,,Eat This Not That! for Kids!: Thousands of Simple Food Swaps That Can Save Your Child from Obesity!,160529943X,9781605299433,3.79,Rodale Books
1739,2484,male,,"Zero Sugar Diet: The 14-Day Plan to Flatten Your Belly, Crush Cravings, and Help Keep You Lean for Life",{'@nil': 'true'},{'@nil': 'true'},3.73,
1740,2484,male,,"Eat This, Not That!: Restaurant Survival Guide",160529540X,9781605295404,3.90,Rodale Books
1741,2484,male,,"Cook This, Not That!: Easy & Awesome 350-Calorie Meals",1605291471,9781605291475,4.02,Rodale Books
1742,2484,male,,Zero Belly Diet: The Revolutionary New Plan to Turn Off Your Fat Genes and Keep You Lean for Life!,0345547950,9780345547958,3.61,Ballantine Books
1743,2484,male,,ABS Diet for Women,1594866244,9781594866241,3.77,Rodale Press
1744,569269,male,"Arcadia, California",Thirteen Reasons Why,1595147888,9781595147882,3.92,Razorbill
1745,569269,male,"Arcadia, California",The Future of Us,1595144919,9781595144911,3.57,Razorbill
1746,569269,male,"Arcadia, California",What Light,1595145516,9781595145512,3.58,Razorbill
1747,569269,male,"Arcadia, California",Piper,0448493667,9780448493664,3.43,Razorbill
1748,569269,male,"Arcadia, California",Sunny Boy: More Than a Family Story,1547166460,9781547166466,3.91,Createspace Independent Publishing Platform
1749,569269,male,"Arcadia, California",Christmas in July: Screenplay,1734039701,9781734039702,3.22,
1750,569269,male,"Arcadia, California",13 Reasons Why Pilot (1x01),{'@nil': 'true'},{'@nil': 'true'},4.40,
1751,569269,male,"Arcadia, California",Any Day Now,{'@nil': 'true'},{'@nil': 'true'},3.83,
1752,569269,male,"Arcadia, California",Night Visions,{'@nil': 'true'},{'@nil': 'true'},3.50,
1753,14774948,,,"Adult Coloring Book Designs: Stress Relief Coloring Book: Garden Designs, Mandalas, Animals, and Paisley Patterns",0692597832,9780692597835,4.12,
1754,14774948,,,Adult Coloring Book Designs: Mandalas: Stress Relief Coloring Book,0692603522,9780692603529,4.67,
1755,14774948,,,Christmas Adult Coloring Book: A Festive Stress Relief Coloring Book,0692803777,9780692803776,4.50,
1756,14774948,,,"Adult Coloring Book Designs: Stress Relieving Patterns, Mandalas, Cats, Flowers, Animals, Henna, and Paisleys for Stress Relief Relaxation and Zen",1539638979,9781539638971,4.00,
1757,14774948,,,Adult Coloring Book: Butterflies and Flowers: Stress Relieving Patterns,1945710047,9781945710049,4.00,New Castle P&p
1758,14774948,,,"Adult Coloring Book Designs: Stress Relieving Patterns, Mandalas, Cats, Flowers, Animals, Henna, and Paisleys for Stress Relief Relaxation and Zen Coloring",1544827008,9781544827001,0.0,
1759,14774948,,,"Happy Christmas Coloring Book: Christmas Decorations, Happy Holidays, Santa Claus, Bells, Snowman, Gifts & More Designs (Coloring Books)",1978325851,9781978325852,0.0,
1760,14774948,,,Farting Animals: A Stinky Adult Coloring Book of Farting Animals to Color,1541240553,9781541240551,0.0,
1761,14774948,,,Adult Coloring Book Animals: Stress Relieving Animal Designs,1540789551,9781540789556,0.0,
1762,14774948,,,The Coloring Book of Stupid Flowers: A Coloring Book Full of Flowers and the Stupid Things They Do!,1542500788,9781542500784,0.0,Createspace Independent Publishing Platform
1763,3041,male,"Chattanooga, Tennessee",American Lion: Andrew Jackson in the White House,1400063256,9781400063253,3.81,Random House
1764,3041,male,"Chattanooga, Tennessee",Thomas Jefferson: The Art of Power,{'@nil': 'true'},{'@nil': 'true'},4.00,Random House
1765,3041,male,"Chattanooga, Tennessee",The Soul of America: The Battle for Our Better Angels,{'@nil': 'true'},{'@nil': 'true'},4.25,
1766,3041,male,"Chattanooga, Tennessee",Franklin and Winston: An Intimate Portrait of an Epic Friendship,0812972821,9780812972825,4.11,Random House Trade
1767,3041,male,"Chattanooga, Tennessee",Destiny and Power: The American Odyssey of George Herbert Walker Bush,{'@nil': 'true'},{'@nil': 'true'},4.06,Random House
1768,3041,male,"Chattanooga, Tennessee","American Gospel: God, the Founding Fathers, and the Making of a Nation",1400065550,9781400065554,3.81,Random House (NY)
1769,3041,male,"Chattanooga, Tennessee",His Truth Is Marching on: John Lewis and the Power of Hope,1984855026,9781984855022,4.62,Random House
1770,3041,male,"Chattanooga, Tennessee","Songs of America: Patriotism, Protest, and the Music That Made a Nation",{'@nil': 'true'},{'@nil': 'true'},3.79,
1771,3041,male,"Chattanooga, Tennessee",The Hope of Glory: Reflections on the Last Words of Jesus from the Cross,0593236661,9780593236666,4.10,
1772,3041,male,"Chattanooga, Tennessee",Thomas Jefferson: President and Philosopher,0385387490,9780385387491,3.99,Crown Books for Young Readers
1773,24556,female,Vancouver,Water for Elephants,1565125606,9781565125605,4.09,Algonquin Books
1774,24556,female,Vancouver,At the Water's Edge,0385523238,9780385523233,3.66,Spiegel & Grau
1775,24556,female,Vancouver,Ape House,0385664443,9780385664448,3.49,Bond Street Books
1776,24556,female,Vancouver,"Riding Lessons (Riding Lessons, #1)",0061241083,9780061241086,3.44,William Morrow Paperbacks
1777,24556,female,Vancouver,"Flying Changes (Riding Lessons, #2)",0061241091,9780061241093,3.71,William Morrow Paperbacks
1778,24556,female,Vancouver,The Sara Gruen Collection: Water for Elephants - At the Water's Edge - Ape House,{'@nil': 'true'},{'@nil': 'true'},4.35,
1779,24556,female,Vancouver,"Sara Gruen Collection! 4 Books Pack Set : Water for Elephants, Ape House, Riding Lessons, Flying Changes",{'@nil': 'true'},{'@nil': 'true'},3.85,
1780,24556,female,Vancouver,So geht's noch besser zum Goethe-/OSD-Zertifikat B1: Testbuch mit 3 CDs,3126758541,9783126758543,3.00,
1781,24556,female,Vancouver,Die Frau am See,{'@nil': 'true'},{'@nil': 'true'},0.0,
1782,20725472,,,,,,,
1783,96150,male,,Drive: The Surprising Truth About What Motivates Us,1594488843,9781594488849,3.95,Riverhead Books
1784,96150,male,,A Whole New Mind: Why Right-Brainers Will Rule the Future,1594481717,9781594481710,3.94,Riverhead Books
1785,96150,male,,When: The Scientific Secrets of Perfect Timing,0735210624,9780735210622,3.80,Riverhead Books
1786,96150,male,,To Sell is Human: The Surprising Truth About Moving Others,1594487154,9781594487156,3.90,Riverhead Books
1787,96150,male,,The Adventures of Johnny Bunko: The Last Career Guide You'll Ever Need,1594482918,9781594482915,3.77,Riverhead Books
1788,96150,male,,Free Agent Nation: The Future of Working for Yourself,0446678791,9780446678797,3.84,Business Plus
1789,96150,male,,The Flip Manifesto,{'@nil': 'true'},{'@nil': 'true'},3.78,Daniel H. Pink
1790,96150,male,,The Seven Dirty Words of the Free Agent Workforce,{'@nil': 'true'},{'@nil': 'true'},3.46,Grand Central Publishing
1791,96150,male,,Daha Önce Kimseden Duymadiginiz Kariyer Sirri,6055755491,9786055755492,3.40,
1792,96150,male,,"Drive Daniel Pink, So Good They Cant Ignore You, Life Leverage, How To Be Fcking Awesome 4 Books Collection Set",9123783931,9789123783939,4.50,
1793,26688,,,Publication Manual of the American Psychological Association,1433805618,9781433805615,3.76,American Psychological Association (APA)
1794,26688,,,Publication Manual of the American Psychological Association 6th Edition,8900720503,9788900720501,3.85,
1795,26688,,,Concise Rules of APA Style,143380560X,9781433805608,3.88,American Psychological Association (APA)
1796,26688,,,APA Style Guide to Electronic References,{'@nil': 'true'},{'@nil': 'true'},4.03,American Psychological Association
1797,26688,,,Mastering APA Style: Student's Workbook and Training Guide,143380557X,9781433805578,4.00,American Psychological Association (APA)
1798,26688,,,Getting In: A Step-By-Step Plan for Gaining Admission to Graduate School in Psychology,1591477999,9781591477990,3.75,American Psychological Association (APA)
1799,26688,,,APA Dictionary of Psychology,1591473802,9781591473800,4.32,American Psychological Association (APA)
1800,26688,,,"Concise Guide to APA Style: Seventh Edition (Newest, 2020 Copyright)",1433832739,9781433832734,4.56,American Psychological Association (APA)
1801,26688,,,Graduate Study in Psychology 2016,1433821176,9781433821172,4.00,American Psychological Association (APA)
1802,26688,,,Standards for Educational and Psychological Testing,0935302352,9780935302356,3.90,American Educational Research Association
1803,1538,male,"Salt Lake City, Utah",The 7 Habits of Highly Effective People: Powerful Lessons in Personal Change,0743269519,9780743269513,4.12,Free Press
1804,1538,male,"Salt Lake City, Utah",First Things First,0684802031,9780684802039,4.11,Free Press
1805,1538,male,"Salt Lake City, Utah",The 8th Habit: From Effectiveness to Greatness,0743287932,9780743287937,4.04,Free Press
1806,1538,male,"Salt Lake City, Utah",Principle-Centered Leadership,0671792806,9780671792800,4.11,Free Press
1807,1538,male,"Salt Lake City, Utah",The 7 Habits of Highly Effective Families,0307440850,9780307440853,4.16,Griffin
1808,1538,male,"Salt Lake City, Utah",The 7 Habits of Highly Effective People Personal Workbook,0743250974,9780743250979,4.25,Simon  Schuster
1809,1538,male,"Salt Lake City, Utah","The Leader in Me: How Schools and Parents Around the World Are Inspiring Greatness, One Child At a Time",1439103267,9781439103265,3.88,Free Press
1810,1538,male,"Salt Lake City, Utah",The Seven Habits Of Highly Effective People And The 8th Habit,192949484X,9781929494842,4.20,FranklinCovey
1811,1538,male,"Salt Lake City, Utah",Living the 7 Habits: The Courage to Change,0684857162,9780684857169,3.97,Free Press
1812,1538,male,"Salt Lake City, Utah",How to Develop Your Personal Mission Statement,{'@nil': 'true'},9781477898048,4.09,
1813,1538,male,"Salt Lake City, Utah",The 7 Habits of Highly Effective People: Powerful Lessons in Personal Change,0743269519,9780743269513,4.12,Free Press
1814,1538,male,"Salt Lake City, Utah",First Things First,0684802031,9780684802039,4.11,Free Press
1815,1538,male,"Salt Lake City, Utah",The 8th Habit: From Effectiveness to Greatness,0743287932,9780743287937,4.04,Free Press
1816,1538,male,"Salt Lake City, Utah",Principle-Centered Leadership,0671792806,9780671792800,4.11,Free Press
1817,1538,male,"Salt Lake City, Utah",The 7 Habits of Highly Effective Families,0307440850,9780307440853,4.16,Griffin
1818,1538,male,"Salt Lake City, Utah",The 7 Habits of Highly Effective People Personal Workbook,0743250974,9780743250979,4.25,Simon  Schuster
1819,1538,male,"Salt Lake City, Utah","The Leader in Me: How Schools and Parents Around the World Are Inspiring Greatness, One Child At a Time",1439103267,9781439103265,3.88,Free Press
1820,1538,male,"Salt Lake City, Utah",The Seven Habits Of Highly Effective People And The 8th Habit,192949484X,9781929494842,4.20,FranklinCovey
1821,1538,male,"Salt Lake City, Utah",Living the 7 Habits: The Courage to Change,0684857162,9780684857169,3.97,Free Press
1822,1538,male,"Salt Lake City, Utah",How to Develop Your Personal Mission Statement,{'@nil': 'true'},9781477898048,4.09,
1823,5333595,female,"Washington, D.C.","Lean In: Women, Work, and the Will to Lead",0385349947,9780385349949,3.95,Knopf
1824,5333595,female,"Washington, D.C.","Option B: Facing Adversity, Building Resilience, and Finding Joy",0753548283,9780753548288,3.87,WH Allen
1825,5333595,female,"Washington, D.C.","Lean in for Graduates: With New Chapters by Experts, Including Find Your First Job, Negotiate Your Salary, and Own Who You Are",0385353677,9780385353670,4.13,Knopf Publishing Group
1826,5333595,female,"Washington, D.C.",Leadership Skills: Essentials of Leadership and the Skills Required to Lead Effectively,1500507873,9781500507879,4.07,Createspace
1827,5333595,female,"Washington, D.C.","Tribute to Late Husband, Dave Goldberg",{'@nil': 'true'},{'@nil': 'true'},4.33,
1828,5333595,female,"Washington, D.C.",Sheryl Sandberg Commencement Address - UC Berkeley - 2016,{'@nil': 'true'},{'@nil': 'true'},4.17,Los Angeles Times
1829,5333595,female,"Washington, D.C.",Cash Credit Loans,{'@nil': 'true'},{'@nil': 'true'},3.90,
1830,5333595,female,"Washington, D.C.","Plano B: Como encarar adversidades, desenvolver resiliência e encontrar felicidade",{'@nil': 'true'},{'@nil': 'true'},3.67,
1831,5333595,female,"Washington, D.C.",VAYAMOS ADELANTE,9871941056,9789871941056,5.00,
1832,5333595,female,"Washington, D.C.","Lean In, The Leader Who Had No Title, I Will Teach You To Be Rich, Secrets of the Millionaire Mind 4 Books Collection Set",9123905980,9789123905980,2.00,
1833,4365,male,,George Washington's Sacred Fire,0978605268,9780978605261,4.19,Providence Forum Press
1834,4365,male,,Seeing Christ in All of Scripture: Hermeneutics at Westminster Theological Seminary,{'@nil': 'true'},9780998005102,3.88,Westminster Seminary Press
1835,4365,male,,Wall of Misconception: Does the Separation of Church and State Mean the Seapration of God and Government?,0978605233,9780978605230,4.11,ISI Distributed Titles
1836,4365,male,,The Binding of God: Calvin's Role in the Development of Covenant Theology,0801022630,9780801022630,3.81,Baker Academic
1837,4365,male,,Thy Word Is Still Truth: Essential Writings on the Doctrine of Scripture from the Reformation to Today,1596384476,9781596384477,4.31,P & R Publishing
1838,4365,male,,Annotations on a Letter That Changed the World from a Birmingham Jail,{'@nil': 'true'},9780984765416,4.54,Providence Forum Press
1839,4365,male,,Business Ethics Today: Foundations,1936927004,9781936927005,4.00,"Center for Christian Business Ethics Today, LLC."
1840,4365,male,,American War for Independence,1591285550,9781591285557,3.56,Canon Press
1841,4365,male,,George Washington & Israel,0984765409,9780984765409,3.83,Providence Forum Press
1842,4365,male,,Saint Peter’s Principles: Leadership for Those Who Already Know Their Incompetence,{'@nil': 'true'},{'@nil': 'true'},3.00,
1843,164692,female,,Little Fires Everywhere,0143135163,9780143135166,4.10,Penguin Books
1844,164692,female,,Everything I Never Told You,159420571X,9781594205712,3.86,Penguin Press
1845,164692,female,,"Girls, At Play",{'@nil': 'true'},{'@nil': 'true'},3.84,Bellevue Literary Review
1846,164692,female,,Every Little Thing,{'@nil': 'true'},{'@nil': 'true'},4.14,The Sunday Times UK
1847,164692,female,,Everything I Never Told You / Little Fires Everywhere,9123919477,9789123919475,4.04,
1848,164692,female,,A Book on the Table:  Flash Fiction,{'@nil': 'true'},9780998449920,3.93,California Bookstore Day Publishing
1849,164692,female,,Clearing the Bones,{'@nil': 'true'},{'@nil': 'true'},3.97,
1850,164692,female,,Ploughshares Summer 2020 Guest-edited by Celeste Ng,{'@nil': 'true'},{'@nil': 'true'},4.11,
1851,164692,female,,Radical Hope: Letters of Love and Dissent in Dangerous Times,0525435131,9780525435136,4.05,Vintage
1852,164692,female,,Six Shorts 2017: The finalists for the 2017 Sunday Times EFG Short Story Award,{'@nil': 'true'},{'@nil': 'true'},3.91,
1853,45539,male,"Dartford, Kent, England",Life,0297854399,9780297854395,3.86,Weidenfeld & Nicolson
1854,45539,male,"Dartford, Kent, England",Gus & Me: The Story of My Granddad and My First Guitar,031632065X,9780316320658,4.04,"Little, Brown Books for Young Readers"
1855,45539,male,"Dartford, Kent, England",Keith Richards: In His Own Words,071193634X,9780711936348,3.74,Omnibus Press
1856,45539,male,"Dartford, Kent, England",Keith Richards: The Playboy Interview (50 Years of the Playboy Interview),{'@nil': 'true'},{'@nil': 'true'},4.20,
1857,45539,male,"Dartford, Kent, England",The Rolling Stones 1972,{'@nil': 'true'},9781452121802,4.10,
1858,45539,male,"Dartford, Kent, England",Fool to Cry Sheet Music,{'@nil': 'true'},{'@nil': 'true'},3.56,
1859,45539,male,"Dartford, Kent, England",Gimme Shelter,{'@nil': 'true'},{'@nil': 'true'},3.21,
1860,45539,male,"Dartford, Kent, England",Bolivia - Culture Smart!,1299563872,9781299563872,4.40,Kuperard
1861,45539,male,"Dartford, Kent, England",Animated Poems,0741463342,9780741463340,3.12,
1862,45539,male,"Dartford, Kent, England",Zycie,8376595490,9788376595498,3.25,
1863,721,male,"Jonesboro, Arkansas","A Time to Kill (Jake Brigance, #1)",{'@nil': 'true'},{'@nil': 'true'},4.08,Dell
1864,721,male,"Jonesboro, Arkansas",The Firm,0582418275,9780582418271,4.02,Addison Wesley Publishing Company
1865,721,male,"Jonesboro, Arkansas",The Client,0385339089,9780385339087,4.02,Delta Trade Paperbacks
1866,721,male,"Jonesboro, Arkansas",The Pelican Brief,0385339704,9780385339704,4.01,Delta
1867,721,male,"Jonesboro, Arkansas",The Runaway Jury,0385339690,9780385339698,3.99,Delta
1868,721,male,"Jonesboro, Arkansas",The Rainmaker,0385339607,9780385339605,3.95,Delta
1869,721,male,"Jonesboro, Arkansas",The Chamber,0385339666,9780385339667,3.80,Delta Trade Paperbacks
1870,721,male,"Jonesboro, Arkansas",The Partner,0385339100,9780385339100,3.93,Delta
1871,721,male,"Jonesboro, Arkansas",The Testament,0440234743,9780440234746,3.86,Island
1872,721,male,"Jonesboro, Arkansas",The Street Lawyer,0385339097,9780385339094,3.84,Bantam
1873,798,male,,Freakonomics: A Rogue Economist Explores the Hidden Side of Everything,0061234001,9780061234002,3.98,William Morrow
1874,798,male,,"SuperFreakonomics: Global Cooling, Patriotic Prostitutes And Why Suicide Bombers Should Buy Life Insurance",0060889578,9780060889579,3.99,William Morrow
1875,798,male,,Think Like a Freak,0062218360,9780062218360,3.86,William Morrow
1876,798,male,,When to Rob a Bank,0062385321,9780062385321,3.50,William Morrow
1877,798,male,,Freakonomics + Superfreakonomics,{'@nil': 'true'},9788535256086,4.26,Campus-Elsevier
1878,798,male,,Readings for Foundations of Communication,1932274316,9781932274318,3.78,
1879,798,male,,Economics of Criminal Law,1845427831,9781845427832,3.82,Edward Elgar Publishing
1880,798,male,,Freakonomics 3,0062218476,9780062218476,3.96,HarperAudio
1881,798,male,,Macroeconomics [with Freakonomics],1405883278,9781405883276,3.85,
1882,798,male,,Microeconomics,146412020X,9781464120206,3.72,Worth Publishers
1883,145416,male,,Gaia: A New Look at Life on Earth,0192862189,9780192862181,3.83,"Oxford University Press, USA"
1884,145416,male,,The Revenge of Gaia,046504168X,9780465041688,3.81,Basic Books
1885,145416,male,,The Vanishing Face of Gaia: A Final Warning,0465015492,9780465015498,3.83,Basic Books
1886,145416,male,,The Ages of Gaia: A Biography of Our Living Earth,0192862170,9780192862174,3.84,"Oxford University Press, USA"
1887,145416,male,,A Rough Ride to the Future,0241004764,9780241004760,3.44,Penguin Books (UK)
1888,145416,male,,Gaia: Medicine for an Ailing Planet,1856752313,9781856752312,4.22,Gaia Books Ltd
1889,145416,male,,Gaia: The Practical Science of Planetary Medicine,0195216741,9780195216745,3.86,"Oxford University Press, USA"
1890,145416,male,,Homage to Gaia: The Life of an Independent Scientist,0198604297,9780198604297,4.04,"Oxford University Press, USA"
1891,145416,male,,EarthDance: Living Systems in Evolution,0595130674,9780595130672,4.31,iUniverse
1892,145416,male,,James Lovelock et al: The Earth and I,383655111X,9783836551113,4.07,Taschen
1893,498072,female,,The Time Traveler's Wife,{'@nil': 'true'},9781939126016,3.98,Zola Books
1894,498072,female,,Her Fearful Symmetry,0224085611,9780224085618,3.26,Jonathan Cape Ltd
1895,498072,female,,The Night Bookmobile,0224089528,9780224089524,3.49,Jonathan Cape
1896,498072,female,,Raven Girl,1419707264,9781419707261,3.32,Harry N. Abrams
1897,498072,female,,The Three Incestuous Sisters,0810959275,9780810959279,3.31,Abrams
1898,498072,female,,Ghostly: A Collection of Ghost Stories,0345810317,9780345810311,3.46,Knopf Canada
1899,498072,female,,The Adventuress,081097052X,9780810970526,3.34,Abrams
1900,498072,female,,Bizarre Romance,1419728539,9781419728532,3.35,Harry N. Abrams
1901,498072,female,,Awake in the Dream World: The Art of Audrey Niffenegger,157687639X,9781576876398,3.68,powerHouse Books
1902,498072,female,,The Chinchilla Girl in Exile,{'@nil': 'true'},{'@nil': 'true'},3.63,
1903,3190,male,"St. Paul, Minnesota",The Great Gatsby,{'@nil': 'true'},{'@nil': 'true'},3.92,Scribner
1904,3190,male,"St. Paul, Minnesota",Tender Is the Night,068480154X,9780684801544,3.81,Scribner
1905,3190,male,"St. Paul, Minnesota",This Side of Paradise,0684843781,9780684843780,3.66,Scribner
1906,3190,male,"St. Paul, Minnesota",The Curious Case of Benjamin Button,1416556052,9781416556053,3.55,Scribner
1907,3190,male,"St. Paul, Minnesota",The Beautiful and Damned,0743451503,9780743451505,3.75,Simon & Schuster
1908,3190,male,"St. Paul, Minnesota",The Short Stories,0684842505,9780684842509,4.23,Scribner
1909,3190,male,"St. Paul, Minnesota",The Love of the Last Tycoon,0020199856,9780020199854,3.65,Scribner
1910,3190,male,"St. Paul, Minnesota",Babylon Revisited and Other Stories,0684824485,9780684824482,3.99,Scribner
1911,3190,male,"St. Paul, Minnesota","The Diamond as Big as the Ritz, and Other Stories",0486299910,9780486299914,3.89,Dover Publications
1912,3190,male,"St. Paul, Minnesota",The Curious Case of Benjamin Button and Six Other Stories,0141190191,9780141190198,3.76,Penguin Books Ltd
1913,15109469,male,"Middletown, Ohio",Hillbilly Elegy: A Memoir of a Family and Culture in Crisis,0062300547,9780062300546,3.92,Harper
