,author_id,gender,hometown,book_title,book_isbn,book_isbn13,book_average_rating,book_publisher
1076,4536964,female,Boston,Great-Great-Grandpa's Hat Box,{'@nil': 'true'},{'@nil': 'true'},4.43,Conde Nast Traveler
1077,4536964,female,Boston,A Glimpse of Stocking,{'@nil': 'true'},{'@nil': 'true'},4.50,
1078,4536964,female,Boston,Closing Time by Amor Towles,{'@nil': 'true'},{'@nil': 'true'},4.20,
1079,4536964,female,Boston,The Line,{'@nil': 'true'},{'@nil': 'true'},4.50,Granta Magazine
1080,4536964,female,Boston,A Gentleman in Moscow: A Novel,{'@nil': 'true'},{'@nil': 'true'},0.0,
1081,346732,male,"Bayonne, New Jersey","A Game of Thrones (A Song of Ice and Fire, #1)",0553588486,9780553588484,4.45,Bantam
1082,346732,male,"Bayonne, New Jersey","A Clash of Kings  (A Song of Ice and Fire, #2)",0553381695,9780553381696,4.41,Bantam
1083,346732,male,"Bayonne, New Jersey","A Storm of Swords (A Song of Ice and Fire, #3)",055357342X,9780553573428,4.53,Bantam
1084,346732,male,"Bayonne, New Jersey","A Feast for Crows (A Song of Ice and Fire, #4)",055358202X,9780553582024,4.14,Bantam Books
1085,346732,male,"Bayonne, New Jersey","A Dance with Dragons (A Song of Ice and Fire, #5)",{'@nil': 'true'},{'@nil': 'true'},4.32,Bantam
1086,346732,male,"Bayonne, New Jersey","A Storm of Swords: Blood and Gold (A Song of Ice and Fire, #3: Part 2 of 2)",0007119550,9780007119554,4.52,HarperVoyager
1087,346732,male,"Bayonne, New Jersey","A Storm of Swords: Steel and Snow (A Song of Ice and Fire, #3: Part 1 of 2)",0006479901,9780006479901,4.44,HarperVoyager
1088,346732,male,"Bayonne, New Jersey","A Knight of the Seven Kingdoms (The Tales of Dunk and Egg, #1-3)",0345533488,9780345533487,4.19,Bantam
1089,346732,male,"Bayonne, New Jersey","A Song of Ice and Fire (A Song of Ice and Fire, #1-4)",0345529057,9780345529053,4.63,
1090,346732,male,"Bayonne, New Jersey","A Song of Ice and Fire (A Song of Ice and Fire, #1-5)",1780484259,9781780484259,4.56,Zatpix
1091,346732,male,"Bayonne, New Jersey","A Game of Thrones (A Song of Ice and Fire, #1)",0553588486,9780553588484,4.45,Bantam
1092,346732,male,"Bayonne, New Jersey","A Clash of Kings  (A Song of Ice and Fire, #2)",0553381695,9780553381696,4.41,Bantam
1093,346732,male,"Bayonne, New Jersey","A Storm of Swords (A Song of Ice and Fire, #3)",055357342X,9780553573428,4.53,Bantam
1094,346732,male,"Bayonne, New Jersey","A Feast for Crows (A Song of Ice and Fire, #4)",055358202X,9780553582024,4.14,Bantam Books
1095,346732,male,"Bayonne, New Jersey","A Dance with Dragons (A Song of Ice and Fire, #5)",{'@nil': 'true'},{'@nil': 'true'},4.32,Bantam
1096,346732,male,"Bayonne, New Jersey","A Storm of Swords: Blood and Gold (A Song of Ice and Fire, #3: Part 2 of 2)",0007119550,9780007119554,4.52,HarperVoyager
1097,346732,male,"Bayonne, New Jersey","A Storm of Swords: Steel and Snow (A Song of Ice and Fire, #3: Part 1 of 2)",0006479901,9780006479901,4.44,HarperVoyager
1098,346732,male,"Bayonne, New Jersey","A Knight of the Seven Kingdoms (The Tales of Dunk and Egg, #1-3)",0345533488,9780345533487,4.19,Bantam
1099,346732,male,"Bayonne, New Jersey","A Song of Ice and Fire (A Song of Ice and Fire, #1-4)",0345529057,9780345529053,4.63,
1100,346732,male,"Bayonne, New Jersey","A Song of Ice and Fire (A Song of Ice and Fire, #1-5)",1780484259,9781780484259,4.56,Zatpix
1101,6984726,,,"Hyperbole and a Half: Unfortunate Situations, Flawed Coping Mechanisms, Mayhem, and Other Things That Happened",1451666179,9781451666175,4.15,Gallery Books
1102,6984726,,,Solutions and Other Problems,1982156945,9781982156947,4.37,Gallery Books
1103,3706,male,"Motihari, Bihar",1984,{'@nil': 'true'},{'@nil': 'true'},4.19,Houghton Mifflin Harcourt
1104,3706,male,"Motihari, Bihar",Animal Farm,0451526341,9780451526342,3.95,Signet Classics
1105,3706,male,"Motihari, Bihar",Animal Farm / 1984,0151010269,9780151010264,4.29,Houghton Mifflin Harcourt
1106,3706,male,"Motihari, Bihar",Down and Out in Paris and London,015626224X,9780156262248,4.09,Mariner Books
1107,3706,male,"Motihari, Bihar",Homage to Catalonia,0156421178,9780156421171,4.10,"Harcourt, Inc.(Harvest Book)"
1108,3706,male,"Motihari, Bihar",Burmese Days,1421808307,9781421808307,3.86,1st World Library
1109,3706,male,"Motihari, Bihar",The Road to Wigan Pier,{'@nil': 'true'},{'@nil': 'true'},3.91,Penguin Classics
1110,3706,male,"Motihari, Bihar",Keep the Aspidistra Flying,0141183721,9780141183725,3.89,Penguin Books Ltd
1111,3706,male,"Motihari, Bihar",Coming Up for Air,0156196255,9780156196253,3.79,Mariner Books
1112,3706,male,"Motihari, Bihar",Shooting an Elephant,0141187395,9780141187396,4.11,Penguin
1113,3164,male,,First 100 Words,0312495412,9780312495411,4.29,St. Martin's Press
1114,3164,male,,My Big Animal Book,0312490836,9780312490836,4.29,Priddy Books
1115,3164,male,,Bright Baby Animals,0312492480,9780312492489,4.06,Priddy Books US
1116,3164,male,,First 100 Animals,0312496761,9780312496760,4.31,Priddy Books US
1117,3164,male,,"Numbers, Colors, Shapes",0312510810,9780312510817,4.25,Priddy Books
1118,3164,male,,B Is for Bear: A Very First Book for the Baby You Love,0312499183,9780312499181,4.47,Priddy Books
1119,3164,male,,Bright Baby First Words,0312493886,9780312493882,3.87,Priddy Books
1120,3164,male,,"Big Board Books Colors, ABC, Numbers",0312502192,9780312502195,4.37,Priddy Books
1121,3164,male,,Alphaprints: ABC,0312516460,9780312516468,4.22,Priddy Books
1122,3164,male,,My Big Truck Book,0312490852,9780312490850,4.24,Priddy Books
1123,20567865,,,,,,,
1124,20280970,,,Frozen 2 (Disney Frozen 2) (Screen Comix),{'@nil': 'true'},{'@nil': 'true'},4.50,
1125,20280970,,,Rapunzel's Perfect Pony (Disney Princess: Palace Pets),{'@nil': 'true'},{'@nil': 'true'},4.00,
1126,20280970,,,Mulan's Happy Panda (Disney Princess: Palace Pets),{'@nil': 'true'},{'@nil': 'true'},5.00,
1127,20280970,,,The Rise of Skywalker (Star Wars),{'@nil': 'true'},{'@nil': 'true'},0.0,
1128,20280970,,,The Clone Wars: Season 7: Volume 1 (Star Wars),{'@nil': 'true'},{'@nil': 'true'},0.0,
1129,20280970,,,The Mandalorian: Season 1: Volume 1 (Star Wars),{'@nil': 'true'},{'@nil': 'true'},0.0,
1130,20280970,,,The Empire Strikes Back (Star Wars),{'@nil': 'true'},{'@nil': 'true'},0.0,
1131,20280970,,,Frozen 2 (Disney Frozen 2),0736441387,9780736441384,0.0,Random House Disney
1132,282885,male,"Fairview, Alberta",12 Rules for Life: An Antidote to Chaos,0345816021,9780345816023,3.94,Random House Canada
1133,282885,male,"Fairview, Alberta",Maps of Meaning: The Architecture of Belief,0415922224,9780415922227,4.10,Routledge
1134,282885,male,"Fairview, Alberta",Personality And Its Transformations,{'@nil': 'true'},{'@nil': 'true'},4.31,
1135,282885,male,"Fairview, Alberta",Essay Writing Guide,{'@nil': 'true'},{'@nil': 'true'},4.28,
1136,282885,male,"Fairview, Alberta",The Psychological Significance Of The Biblical Stories: Genesis,{'@nil': 'true'},{'@nil': 'true'},4.60,
1137,282885,male,"Fairview, Alberta","Religion, Sovereignty, Natural Rights, And The Constituent Elements Of Experience",{'@nil': 'true'},{'@nil': 'true'},3.37,
1138,282885,male,"Fairview, Alberta",10 Step Guide to Clearer Thinking Through Essay Writing,{'@nil': 'true'},{'@nil': 'true'},3.82,
1139,282885,male,"Fairview, Alberta",Peacemaking Among Higher Order Primates - Jordan B Peterson: Jordan B Peterson Fulltext,1726826910,9781726826914,2.89,Independently Published
1140,282885,male,"Fairview, Alberta",Political Correctness Gone Mad?,1786076047,9781786076045,3.26,
1141,282885,male,"Fairview, Alberta","Jordan B. Peterson 2 Books Collection Set (12 Rules for Life [Hardcover], Maps of Meaning)",9123821248,9789123821242,3.17,
1142,3064249,male,,"Delivering Happiness: A Path to Profits, Passion, and Purpose",0446563048,9780446563048,4.01,Grand Central Publishing
1143,3064249,male,,Delivering Happiness,{'@nil': 'true'},{'@nil': 'true'},4.00,
1144,3064249,male,,Exceptional Customer Service: Exceed Customer Expectations to Build Loyalty  Boost Profits,1605500380,9781605500386,4.03,Adams Media
1145,3064249,male,,L'entreprise du bonheur (Zen business),{'@nil': 'true'},{'@nil': 'true'},3.85,
1146,3064249,male,,Il segreto delle aziende in cui è (davvero) bello lavorare,{'@nil': 'true'},9788886696630,3.82,
1147,3064249,male,,Tỷ phú bán giày,{'@nil': 'true'},{'@nil': 'true'},4.08,
1148,3064249,male,,Satisfação garantida,{'@nil': 'true'},{'@nil': 'true'},4.80,
1149,3064249,male,,"Delivering Happiness, Deep Work, The 7 Habits of Highly Effective People, 4 Disciplines of Execution 4 Books Collection Set",9123899018,9789123899012,5.00,
1150,3064249,male,,Emotional Equations: Simple Truths for Creating Happiness + Success,{'@nil': 'true'},{'@nil': 'true'},3.72,
1151,3064249,male,,The Power of WOW: How to Electrify Your Work and Your Life by Putting Service First,{'@nil': 'true'},{'@nil': 'true'},4.00,
1152,3780,male,"Newburgh, New York","Along Came a Spider (Alex Cross, #1)",0446692638,9780446692632,4.11,Grand Central Publishing
1153,3780,male,"Newburgh, New York","Kiss the Girls (Alex Cross, #2)",0446677388,9780446677387,3.97,Grand Central Publishing
1154,3780,male,"Newburgh, New York","1st to Die (Women's Murder Club, #1)",0446696617,9780446696616,4.08,Grand Central Publishing
1155,3780,male,"Newburgh, New York","The Angel Experiment (Maximum Ride, #1)",0446617792,9780446617796,4.07,Grand Central Publishing
1156,3780,male,"Newburgh, New York",Suzanne's Diary for Nicholas,0446611085,9780446611084,4.17,Vision
1157,3780,male,"Newburgh, New York","School's Out—Forever (Maximum Ride, #2)",0316155594,9780316155595,4.15,"Little, Brown and Company"
1158,3780,male,"Newburgh, New York",Sam's Letters to Jennifer,0446613347,9780446613347,4.16,Grand Central Publishing
1159,3780,male,"Newburgh, New York","2nd Chance (Women's Murder Club, #2)",0446696633,9780446696630,4.04,Grand Central Publishing
1160,3780,male,"Newburgh, New York","Saving the World and Other Extreme Sports (Maximum Ride, #3)",0316155608,9780316155601,4.15,"Little, Brown and Company"
1161,3780,male,"Newburgh, New York",The Beach House,0446612545,9780446612548,3.85,Grand Central Publishing
1162,8529755,male,Austin,The Subtle Art of Not Giving a F*ck: A Counterintuitive Approach to Living a Good Life,{'@nil': 'true'},{'@nil': 'true'},3.94,Harper
1163,8529755,male,Austin,Everything is F*cked: A Book About Hope,0062955934,9780062955937,3.75,Harper
1164,8529755,male,Austin,Models: Attract Women Through Honesty,1463750358,9781463750350,4.38,Createspace Independent Publishing Platform
1165,8529755,male,Austin,The Nerd's Guide to Being Confident,{'@nil': 'true'},{'@nil': 'true'},3.48,
1166,8529755,male,Austin,Love Is Not Enough,{'@nil': 'true'},{'@nil': 'true'},4.03,Audible
1167,8529755,male,Austin,Mark Manson on Self-Knowledge,{'@nil': 'true'},{'@nil': 'true'},4.11,
1168,8529755,male,Austin,The Guide to Relationships,{'@nil': 'true'},{'@nil': 'true'},4.10,Mark Manson
1169,8529755,male,Austin,3 Ideas That Can Change Your Life,{'@nil': 'true'},{'@nil': 'true'},4.04,
1170,8529755,male,Austin,Mark Manson on Happiness,{'@nil': 'true'},{'@nil': 'true'},4.08,
1171,8529755,male,Austin,Mark Manson on Relationships,{'@nil': 'true'},{'@nil': 'true'},4.03,
1172,14717347,,,Difficult Riddles For Smart Kids: 300 Difficult Riddles And Brain Teasers Families Will Love,{'@nil': 'true'},{'@nil': 'true'},3.92,
1173,14717347,,,Riddles For Kids: Over 300 Riddles and Jokes for Children,{'@nil': 'true'},{'@nil': 'true'},3.98,
1174,14717347,,,Math Riddles For Smart Kids: Math Riddles and Brain Teasers that Kids and Families will Love,{'@nil': 'true'},{'@nil': 'true'},3.96,
1175,14717347,,,"The Big Book of Quotes: Funny, Inspirational and Motivational Quotes on Life, Love and Much Else",{'@nil': 'true'},{'@nil': 'true'},3.89,
1176,14717347,,,The Funniest Quotes Book: 1001 Of The Best Humourous Quotations,{'@nil': 'true'},{'@nil': 'true'},4.01,
1177,14717347,,,Jokes For Kids: Over 500 of the Funniest Jokes That Children Will Love,{'@nil': 'true'},{'@nil': 'true'},3.83,
1178,14717347,,,Golf It's A Funny Old Game: The Funniest Quotes About Golf,{'@nil': 'true'},{'@nil': 'true'},3.86,
1179,14717347,,,Tongue Twisters For Kids: Over 150 of the Toughest Tongue Twisters that children will love,{'@nil': 'true'},{'@nil': 'true'},4.29,
1180,14717347,,,"The Best What Am I Riddles: 300 Riddles, Brainteasers And Puzzles For The Whole Family",{'@nil': 'true'},{'@nil': 'true'},3.10,
1181,14717347,,,Riddles For Kids 2: Over 300 Riddles and Jokes For Children,{'@nil': 'true'},{'@nil': 'true'},4.46,
1182,93353,,Adis Ababa,Cutting for Stone,0375414495,9780375414497,4.29,Alfred A. Knopf
1183,93353,,Adis Ababa,My Own Country: A Doctor's Story,0679752927,9780679752929,4.20,Vintage
1184,93353,,Adis Ababa,The Tennis Partner,0060931132,9780060931131,3.90,Harper Perennial
1185,93353,,Adis Ababa,Short Stories,0701165537,9780701165536,3.50,Chatto and Windus
1186,93353,,Adis Ababa,The Maramon Convention,{'@nil': 'true'},{'@nil': 'true'},3.88,Scribner
1187,93353,,Adis Ababa,When Breath Becomes Air,039956618X,9780399566189,4.36,Books on Tape
1188,93353,,Adis Ababa,A Life in Medicine: A Literary Anthology,1565848497,9781565848498,4.00,The New Press
1189,93353,,Adis Ababa,Silence Kills: Speaking Out and Saving Lives,0870745182,9780870745188,3.58,Southern Methodist University Press
1190,93353,,Adis Ababa,Working on a Miracle,0553379348,9780553379341,3.93,Bantam Dell Pub Group (P)
1191,93353,,Adis Ababa,Stanford Medicine Magazine: The Best of 2011,{'@nil': 'true'},{'@nil': 'true'},4.50,Stanford University School of Medicine
1192,13747,male,"New Haven, Connecticut",Decision Points,0307590615,9780307590619,3.79,Crown
1193,13747,male,"New Haven, Connecticut",41: A Portrait of My Father,0553447785,9780553447781,4.04,Crown
1194,13747,male,"New Haven, Connecticut",Portraits of Courage: A Commander in Chief's Tribute to America's Warriors,1524757527,9781524757526,4.34,Books on Tape
1195,13747,male,"New Haven, Connecticut",A Charge to Keep: My Journey to the White House,0060957921,9780060957926,3.60,William Morrow Paperbacks
1196,13747,male,"New Haven, Connecticut","We Will Prevail: President George W. Bush on War, Terrorism and Freedom",0826415520,9780826415523,3.81,Bloomsbury Academic
1197,13747,male,"New Haven, Connecticut",A Charge Kept: The Record of the Bush Presidency 2001 - 2009,1600375898,9781600375897,3.72,Morgan James Publishing
1198,13747,male,"New Haven, Connecticut",George W. Bush Speaks to the Nation,0936783400,9780936783406,3.38,Merril Press
1199,13747,male,"New Haven, Connecticut",National Strategy for Combating Terrorism,1600375839,9781600375835,4.50,Morgan James Publishing
1200,13747,male,"New Haven, Connecticut",決断のとき,4532167825,9784532167820,4.33,
1201,13747,male,"New Haven, Connecticut",The Selected Quotations of George W. Bush,1879094827,9781879094826,4.33,Momentum Books LLC
1202,11466,male,Sydney,The Book Thief,0375831002,9780375831003,4.37,Alfred A. Knopf
1203,11466,male,Sydney,I Am the Messenger,0375836675,9780375836671,4.05,Alfred A. Knopf Borzoi Books
1204,11466,male,Sydney,Bridge of Clay,0385614292,9780385614290,3.80,Doubleday
1205,11466,male,Sydney,"Getting the Girl (Wolfe Brothers, #3)",043938950x,9780439389501,3.70,Push
1206,11466,male,Sydney,"Fighting Ruben Wolfe (Wolfe Brothers, #2)",0439241871,9780439241878,3.84,Push
1207,11466,male,Sydney,"Underdog (Wolfe Brothers, #1)",3473352349,9783473352340,3.37,Ravensburger Buchverlag
1208,11466,male,Sydney,"Underdogs (Wolfe Brothers, #1-3)",0545354420,9780545354424,3.90,"Scholastic, Inc."
1209,11466,male,Sydney,The Book Thief / I Am the Messenger,0553510266,9780553510263,4.41,Knopf Books for Young Readers
1210,11466,male,Sydney,XXL-Leseprobe: Nichts weniger als ein Wunder,{'@nil': 'true'},{'@nil': 'true'},3.60,
1211,11466,male,Sydney,Poslaniec,8310134738,9788310134738,3.83,
1212,17945766,,,,,,,
1213,47449,male,Yonkers,The Amateur,1596987855,9781596987852,3.81,Regnery Publishing
1214,47449,male,Yonkers,Blood Feud: The Clintons vs. the Obamas,1621573133,9781621573135,3.76,Regnery Publishing
1215,47449,male,Yonkers,The Kennedy Curse: Why Tragedy Has Haunted America's First Family for 150 Years,0312312938,9780312312930,3.64,St. Martin's Griffin
1216,47449,male,Yonkers,Guilty as Sin: Uncovering New Evidence of Corruption and How Hillary Clinton and the Democrats Derailed the FBI Investigation,{'@nil': 'true'},{'@nil': 'true'},4.28,
1217,47449,male,Yonkers,All Too Human the Love Story of Jack and Jackie Kennedy,0671501917,9780671501914,3.90,Pocket Books
1218,47449,male,Yonkers,Unlikeable: The Problem with Hillary,1621573788,9781621573784,3.80,Regnery Publishing
1219,47449,male,Yonkers,All Out War: The Plot to Destroy Trump,{'@nil': 'true'},{'@nil': 'true'},4.24,
1220,47449,male,Yonkers,"The Truth about Hillary: What She Knew, When She Knew It, and How Far She'll Go to Become President",1595230238,9781595230232,3.38,Sentinel
1221,47449,male,Yonkers,Just Jackie: Her Private Years,{'@nil': 'true'},{'@nil': 'true'},3.92,
1222,47449,male,Yonkers,"Farewell, Jackie: A Portrait of Her Final Days",0670033316,9780670033317,3.79,Viking Books
1223,4039811,female,,"Divergent (Divergent, #1)",0062024035,9780062024039,4.19,Katherine Tegen Books
1224,4039811,female,,"Insurgent (Divergent, #2)",0007442912,9780007442911,4.02,HarperCollins Children's Books
1225,4039811,female,,"Allegiant (Divergent, #3)",0007524277,9780007524273,3.62,HarperCollins Children's Book's
1226,4039811,female,,"Four: A Divergent Story Collection (Divergent, #0.1-0.4)",0062285688,9780062285683,4.03,HarperCollins Publishers
1227,4039811,female,,"Free Four: Tobias Tells the Divergent Knife-Throwing Scene (Divergent, #1.5)",006223742X,9780062237422,4.15,Katherine Tegen Books
1228,4039811,female,,"The Transfer (Divergent, #0.1)",0062285637,9780062285638,4.18,Katherine Tegen Books
1229,4039811,female,,"Carve the Mark (Carve the Mark, #1)",0062348639,9780062348630,3.78,Katherine Tegen Books
1230,4039811,female,,"The World of Divergent: The Path to Allegiant (Divergent, #2.5)",0062300806,9780062300805,3.96,Katherine Tegen Books
1231,4039811,female,,"Divergent Series Complete Box Set (Divergent, #1-3)",0062278789,9780062278784,4.30,Katherine Tegen Books
1232,4039811,female,,Inside Divergent: The Initiate's World,0062315609,9780062315601,4.36,Katherine Tegen Books
1233,1630,male,"Waukegan, Illinois",Fahrenheit 451,{'@nil': 'true'},{'@nil': 'true'},3.99,Simon & Schuster
1234,1630,male,"Waukegan, Illinois",The Martian Chronicles,0553278223,9780553278224,4.14,Bantam/Spectra
1235,1630,male,"Waukegan, Illinois","Something Wicked This Way Comes (Green Town, #2)",0380729407,9780380729401,3.93,Harper Voyager
1236,1630,male,"Waukegan, Illinois",The Illustrated Man,000712774X,9780007127740,4.12,Voyager Classics / Harper Collins
1237,1630,male,"Waukegan, Illinois","Dandelion Wine (Green Town, #1)",0671037706,9780671037703,4.07,Earthlight (UK)
1238,1630,male,"Waukegan, Illinois",The Halloween Tree,0375803017,9780375803017,3.83,Yearling
1239,1630,male,"Waukegan, Illinois",Zen in the Art of Writing,0553296345,9780553296341,4.10,Bantam
1240,1630,male,"Waukegan, Illinois",The October Country,0380973871,9780380973873,4.15,William Morrow
1241,1630,male,"Waukegan, Illinois",I Sing the Body Electric! & Other Stories,0380789620,9780380789627,4.06,William Morrow Paperbacks
1242,1630,male,"Waukegan, Illinois",A Medicine for Melancholy and Other Stories,{'@nil': 'true'},{'@nil': 'true'},4.16,Avon Books
1243,5202174,male,New Jersey,The Harbinger: The Ancient Mystery that Holds the Secret of America's Future,161638610X,9781616386108,3.96,Frontline
1244,5202174,male,New Jersey,"The Mystery of the Shemitah: The 3,000-Year-Old Mystery That Holds the Secret of America's Future, the World's Future, and Your Future!",1629981931,9781629981932,4.10,Frontline
1245,5202174,male,New Jersey,The Paradigm: The Ancient Blueprint That Holds the Mystery of Our Times,1629994766,9781629994765,4.41,Frontline
1246,5202174,male,New Jersey,The Oracle: The Jubilean Mysteries Unveiled,{'@nil': 'true'},{'@nil': 'true'},4.37,
1247,5202174,male,New Jersey,The Harbinger II: The Return,{'@nil': 'true'},{'@nil': 'true'},4.72,
1248,5202174,male,New Jersey,The Book of Mysteries,162998941X,9781629989419,4.53,Frontline
1249,5202174,male,New Jersey,The Harbinger Companion With Study Guide: Decode the Mysteries and Respond to the Call that Can Change America's Future and  Yours,1621362450,9781621362456,4.44,Frontline
1250,5202174,male,New Jersey,The Harbinger Decoded,1621365239,9781621365235,4.35,Frontline
1251,5202174,male,New Jersey,The Book of Mysteries Prayer Journal,1629991309,9781629991306,4.73,Frontline
1252,5202174,male,New Jersey,The Harbinger / The Harbinger Decoded,9636899169,9789636899165,4.08,
1253,1274669,,,No Easy Day: The Firsthand Account of the Mission That Killed Osama Bin Laden,0525953728,9780525953722,3.99,Dutton Books
1254,1274669,,,No Hero: The Evolution of a Navy SEAL,052595452X,9780525954521,4.13,Dutton
1255,1274669,,,Não há dia fácil,{'@nil': 'true'},9788580864274,4.11,
1256,1274669,,,Mission erfüllt: Navy Seals im Einsatz: Wie wir Osama bin Laden aufspürten und zur Strecke brachten,3453200381,9783453200388,4.71,
1257,1274669,,,NAVY SEAL - hvad jeg har lært af ET LIV I KRIG,{'@nil': 'true'},9788711618370,4.29,Lindhardt og Ringhof
1258,1274669,,,Mission erfüllt: Navy Seals im Einsatz: Wie wir Osama Bin Laden aufspürten und zur Strecke brachten,3453603427,9783453603424,5.00,
1259,1274669,,,Ce Jour-L. Au Coeur Du Commando Qui a Tu' Ben Laden,2757836099,9782757836095,4.00,Contemporary French Fiction
1260,1274669,,,Other Than Flashbacks,{'@nil': 'true'},{'@nil': 'true'},3.67,
1261,1274669,,,Trouble at Borrasca Rim,{'@nil': 'true'},{'@nil': 'true'},4.00,Fawcett Publications
1262,1274669,,,Harry's War: Military Memoirs of Sgt Harry Walton,{'@nil': 'true'},{'@nil': 'true'},3.50,
1263,1790133,,,The Mueller Report,{'@nil': 'true'},{'@nil': 'true'},4.26,
1264,1790133,,,The Mueller Report Illustrated: The Obstruction Investigation,1982149272,9781982149277,4.24,Scribner
1265,1790133,,,Landmark: The Inside Story of America's New Health-Care Law and What It Means for Us All,1410428990,9781410428998,3.58,Thorndike Press
1266,1790133,,,"Donald Trump and His Assault on Truth: The President's Falsehoods, Misleading Claims and Flat-Out Lies",{'@nil': 'true'},{'@nil': 'true'},4.18,
1267,1790133,,,NSA Secrets: Government Spying in the Internet Age,{'@nil': 'true'},{'@nil': 'true'},3.68,
1268,1790133,,,The Original Watergate Stories,1938120582,9781938120589,4.01,Diversion Books
1269,1790133,,,Civil War Stories: A 150th Anniversary Collection,{'@nil': 'true'},{'@nil': 'true'},4.17,
1270,1790133,,,State of Terror: The War Against ISIS,{'@nil': 'true'},{'@nil': 'true'},3.65,
1271,1790133,,,Runaway Planet: How Global Warming is Already Changing the Earth,{'@nil': 'true'},{'@nil': 'true'},3.90,
1272,1790133,,,Justice For None: How the Drug War Broke the Legal System,{'@nil': 'true'},{'@nil': 'true'},4.04,
1273,346732,male,"Bayonne, New Jersey","A Game of Thrones (A Song of Ice and Fire, #1)",0553588486,9780553588484,4.45,Bantam
1274,346732,male,"Bayonne, New Jersey","A Clash of Kings  (A Song of Ice and Fire, #2)",0553381695,9780553381696,4.41,Bantam
1275,346732,male,"Bayonne, New Jersey","A Storm of Swords (A Song of Ice and Fire, #3)",055357342X,9780553573428,4.53,Bantam
1276,346732,male,"Bayonne, New Jersey","A Feast for Crows (A Song of Ice and Fire, #4)",055358202X,9780553582024,4.14,Bantam Books
1277,346732,male,"Bayonne, New Jersey","A Dance with Dragons (A Song of Ice and Fire, #5)",{'@nil': 'true'},{'@nil': 'true'},4.32,Bantam
1278,346732,male,"Bayonne, New Jersey","A Storm of Swords: Blood and Gold (A Song of Ice and Fire, #3: Part 2 of 2)",0007119550,9780007119554,4.52,HarperVoyager
1279,346732,male,"Bayonne, New Jersey","A Storm of Swords: Steel and Snow (A Song of Ice and Fire, #3: Part 1 of 2)",0006479901,9780006479901,4.44,HarperVoyager
1280,346732,male,"Bayonne, New Jersey","A Knight of the Seven Kingdoms (The Tales of Dunk and Egg, #1-3)",0345533488,9780345533487,4.19,Bantam
1281,346732,male,"Bayonne, New Jersey","A Song of Ice and Fire (A Song of Ice and Fire, #1-4)",0345529057,9780345529053,4.63,
1282,346732,male,"Bayonne, New Jersey","A Song of Ice and Fire (A Song of Ice and Fire, #1-5)",1780484259,9781780484259,4.56,Zatpix
1283,346732,male,"Bayonne, New Jersey","A Game of Thrones (A Song of Ice and Fire, #1)",0553588486,9780553588484,4.45,Bantam
1284,346732,male,"Bayonne, New Jersey","A Clash of Kings  (A Song of Ice and Fire, #2)",0553381695,9780553381696,4.41,Bantam
1285,346732,male,"Bayonne, New Jersey","A Storm of Swords (A Song of Ice and Fire, #3)",055357342X,9780553573428,4.53,Bantam
1286,346732,male,"Bayonne, New Jersey","A Feast for Crows (A Song of Ice and Fire, #4)",055358202X,9780553582024,4.14,Bantam Books
1287,346732,male,"Bayonne, New Jersey","A Dance with Dragons (A Song of Ice and Fire, #5)",{'@nil': 'true'},{'@nil': 'true'},4.32,Bantam
1288,346732,male,"Bayonne, New Jersey","A Storm of Swords: Blood and Gold (A Song of Ice and Fire, #3: Part 2 of 2)",0007119550,9780007119554,4.52,HarperVoyager
1289,346732,male,"Bayonne, New Jersey","A Storm of Swords: Steel and Snow (A Song of Ice and Fire, #3: Part 1 of 2)",0006479901,9780006479901,4.44,HarperVoyager
1290,346732,male,"Bayonne, New Jersey","A Knight of the Seven Kingdoms (The Tales of Dunk and Egg, #1-3)",0345533488,9780345533487,4.19,Bantam
1291,346732,male,"Bayonne, New Jersey","A Song of Ice and Fire (A Song of Ice and Fire, #1-4)",0345529057,9780345529053,4.63,
1292,346732,male,"Bayonne, New Jersey","A Song of Ice and Fire (A Song of Ice and Fire, #1-5)",1780484259,9781780484259,4.56,Zatpix
1293,4102094,female,,Creative Haven Art Nouveau Animal Designs Coloring Book,0486493105,9780486493107,4.28,Dover Publications
1294,4102094,female,,Paisley Designs,0486456420,9780486456423,4.18,Dover Publications
